domain,mode,tone,reading_level,title,paragraph,style.sentence_length,style.figurative_language,style.concreteness,style.viewpoint,style.temporal_focus
nature_travel,narrative,reflective,Grade8,The Unexpected Forest Encounter,"As I strolled through the dense forest one cool morning, the towering trees whispered softly in the breeze, creating an ethereal atmosphere. The ground was a tapestry of fallen leaves, crunching lightly underfoot as I moved. Sunlight streamed through the canopy, painting patterns on the forest floor. Suddenly, a rustling sound drew my attention. Curious, I veered off the beaten path and found myself in a small clearing where a family of deer grazed quietly. They were utterly serene, unbothered by my presence, their fur glistening like polished wood. As I stood there, a deep sense of tranquility washed over me. The world seemed to pause, and all that mattered was this moment of connection with nature. Watching them, I realized how much beauty lay hidden in the everyday, often overlooked by hurried eyes. Eventually, I retraced my steps, leaving the deer to their peaceful haven, but the memory lingered in my mind, a gentle reminder of the unexpected wonders that life sometimes offers when you take the time to wander and observe.",mixed,medium,mixed,1st,past
nature_travel,expository,formal,Grade12,Dynamics of Tidal Ecosystems,"The intricate dynamics of tidal ecosystems present a complex interplay between saltwater and freshwater influences, where organisms adapt to the rhythmic ebb and flow of tides. These areas serve as crucial habitats for various species, ranging from migratory birds to aquatic life. Tides oscillate due to the gravitational pull of the moon and sun, leading to the periodic inundation and exposure of these habitats. This cyclical nature fosters biodiversity, as species have evolved unique adaptations to cope with changing salinity and moisture levels. For example, certain plants have developed specialized roots that allow them to filter salt from water, while some fish possess gills capable of adjusting to different levels of salinity. Additionally, tidal ecosystems function as natural buffers, mitigating the impacts of coastal erosion and storm surges. They also contribute to sediment deposition, which fortifies land against the encroaching sea. Moreover, these environments play a significant role in global nutrient cycles, where tidal flows facilitate the exchange of nutrients between terrestrial and marine systems. However, the rising sea levels and increasing human activity pose substantial threats to these delicate ecosystems, necessitating a concerted effort in conservation and sustainable management practices. By understanding and preserving these ecological systems, we ensure their continued benefits for future generations.",long,low,abstract,3rd,present
nature_travel,descriptive,technical,Undergraduate,Sand Dunes of the Gobi Desert,"In the vast expanse of the Gobi Desert, the dunes undulate like frozen waves. These sand formations are dynamic, shaped by relentless winds. Scientists predict their forms will continuously change. The dunes are composed of quartz sand, allowing them to shimmer under the sun's intense rays. Reflective surfaces accentuate their beauty, turning them into geological spectacles. Their heights vary, some surpassing one hundred meters. These towering dunes provide a habitat for unique flora and fauna. Desert grasses cling tenaciously to the dunes' base, preventing erosion. Various insects and reptiles have adapted to this harsh environment. They depend on the sparse vegetation and elusive moisture, retaining water efficiently. Furthermore, the desert's ecosystem is fragile. It requires meticulous protection against external disruptions. Exploration by future geologists will reveal more about the interactions between abiotic and biotic components in this desert. Understanding the interplay between these components is vital for retention of biodiversity. Hence, continued research on such formations is essential for sustaining the Gobi's ecological balance.",short,none,concrete,3rd,future
nature_travel,process_explanation,plain,Graduate,Camping in the Wilderness,"When preparing for a camping trip into the wilderness, it is imperative to meticulously plan each aspect to ensure safety and enjoyment. Start by researching the terrain and weather conditions of the designated location to ascertain what specific equipment and clothing will be necessary. Proper gear should include a durable tent, a reliable sleeping bag appropriate for the expected temperature range, and sufficient water filtration systems to ensure access to clean water. As you embark on setting up camp, select a site that is level and free of hazards such as falling branches. This position should ideally be on elevated ground to prevent flooding in case of unexpected rain. Pitching your tent in this manner fosters safety and comfort. Additionally, familiarize yourself with local wildlife and food storage requirements to minimize the risk of encounters. Following Leave No Trace principles can help maintain the natural beauty and integrity of the ecosystem, ensuring that future campers can similarly enjoy pristine conditions. Lastly, prepare a first aid kit, including essential items like antiseptics, bandages, and any personal medications, to address potential injuries or ailments. By thoughtfully organizing every step of your excursion, from logistics to the campsite practices, you can have a successful and rewarding wilderness camping experience.",long,low,concrete,2nd,present
nature_travel,persuasive,conversational,Grade8,Join the Urban Green Marathon,"Have you ever thought about joining the Urban Green Marathon? Imagine running through city streets transformed into a runner's paradise, surrounded by lush green spaces and air that feels fresher than ever before. Participating in such an event is not just about racing; it’s about becoming part of a movement that champions environmental awareness and fitness. As you lace up your sneakers and hit the pavement, you’re not only improving your health but also supporting green initiatives. You're helping to ensure that urban spaces remain harmonious with nature. The event takes participants through various beautifully landscaped parks, allowing you to experience the natural world amidst urban life. And don’t worry if you’re not the fastest runner; what truly counts here is your commitment to a healthier planet and self. So why not join us and be the change you wish to see? This marathon is more than a run; it’s a chance to make a statement, to meet like-minded people, and to enjoy a day of fun and inspiration. The road may be challenging, but with every step, you contribute to a greener future. Sign up today, and let's make a difference together, one mile at a time.",mixed,medium,mixed,2nd,present
nature_travel,narrative,formal,Grade12,The Discovery of the Hidden Valley,"Early one chill autumn morning, a group of seasoned adventurers embarked on an arduous trek through the remote mountain ranges that straddled civilization's edge. For years, rumors of an enigmatic valley replete with extraordinary flora and fauna had tantalized explorers. The party, led by an intrepid biologist with an affinity for secrets of nature, trudged for days through dense fog and treacherous paths. As the sun ascended on the fifth day, piercing dense clouds, they glimpsed an opening between two towering peaks. What lay beyond astounded them. It was a verdant hidden valley, untouched by time, where ancient trees reached skyward, their branches thick with moss. A symphony of birdsong filled the air, and streams meandered through the vibrant landscape, sparkling under the sunlight. Species thought extinct thrived in abundance, showcasing nature's resilience. In this secluded paradise, the air was imbued with tranquility, and the explorers were overcome by a profound sense of wonder and accomplishment. Documenting their findings meticulously, they understood the significance of this discovery, not only for its scientific value but as a reminder of nature's mysterious capacity to surprise and delight the human spirit. The valley, now a testament to the planet's enduring mysteries, beckoned only those willing to brave the unknown in search of truth and beauty.",long,low,abstract,3rd,past
nature_travel,expository,technical,Undergraduate,Antarctic Ice Sheet Dynamics,"In the future, understanding Antarctic ice sheet dynamics will be paramount in predicting global sea-level changes. These vast ice masses exist in a delicate balance between accumulation and ablation processes. Accumulation occurs through snowfall, which over time compresses into glacial ice, while ablation involves the melting and calving of icebergs into surrounding waters. Climate models suggest increased temperatures will accelerate melting rates, posing potential implications for coastal regions worldwide. Adaptation strategies are required to cope with these predicted changes. Scientific teams will continue deploying advanced satellite technology to monitor ice thickness and movement, generating comprehensive data sets to refine model accuracy further. By integrating different scientific disciplines, researchers aim to enhance their understanding of ice sheet dynamics. Consequently, this will aid policymakers in forming an effective response to mitigate the potential impacts. Ongoing interdisciplinary collaboration is essential to address these challenges. Ultimately, the quest to comprehend and predict the behavior of Antarctic ice sheets is a focal point in ongoing efforts to better grasp the intricacies of our planet's changing climate system.",mixed,none,abstract,3rd,future
nature_travel,descriptive,playful,Grade12,A Day in Flower-Kissed Meadows,"Ah, the glorious meadow! It beckoned me with its floral finery as soon as I stepped out of the forest's looming shadows. Each blade of grass seemed to dance with a spirit of its own, whispering secrets of sunlight and summer breezes. A riot of colors stretched across the field, where violets blushed next to daffodils dancing like jubilant fairies in the breeze. The air was infused with an intoxicating perfume, a fragrant bouquet crafted by nature herself. With childlike enthusiasm, I lay amidst the blooms, feeling them cradle me as I gazed at the azure sky dotted with puffy clouds, as if they were sheep lazily grazing in the sky's pasture. Butterflies flitted from flower to flower, a flurry of vibrant colors and delicate wings. Time melted away as I fully immersed myself in that idyllic world, a whimsical tapestry woven by nature's hand. Losing myself in the meadow's embrace, I realized that it was more than a simple expanse of land; it was a symphony of life, a playground where every element sang in harmonious unity. That day, the meadow's floral kingdom was both my refuge and my escape, a sunlit dream stitched into the fabric of reality.",mixed,high,concrete,1st,past
nature_travel,process_explanation,reflective,Undergraduate,Navigating the Art of Stargazing,"Venturing into the world of stargazing promises an experience that connects the vastness of the cosmos with the intimacy of personal reflection. The process begins with selecting a location away from city lights where the night sky reveals its true splendor. Equip yourself with a planisphere or a reliable application to identify celestial bodies that dot the expansive canvas above. As you lie beneath the infinite expanse, patience becomes your companion, and time seems to stretch as constellations unfold before your eyes. Discovering familiar patterns and tracing legendary stories in the stars can evoke profound thoughts about humanity's place in the universe. Embrace those moments of stillness, as they have the power to illuminate paths of self-awareness amidst the stars' distant glow. The dance of meteors across the sky may surprise you, leaving ephemeral trails that ignite curiosity and wonder. Remember to give yourself the time and space to explore, as each stargazing session brings a unique experience shaped by the Earth's rotation and the celestial symphony above. Over time, as you develop an understanding of these cosmic patterns, you might find that the beauty of stargazing lies as much in the journey of discovery as in the static wonder itself. So, continue to engage with the universe, for the more you explore, the more you'll unveil the profound mysteries tucked away in the night sky.",long,medium,mixed,2nd,present
nature_travel,persuasive,technical,Graduate,Advocating for High-Altitude Conservation,"In the realm of high-altitude ecosystems, advancing conservation efforts is a quintessential responsibility. These ecosystems, characterized by their unique biodiversity, mountain climates, and geological formations, demand specialized conservation strategies. Instituting such measures ensures the integrity and continuity of critical ecological processes, even under anthropogenic pressure induced by climate change and tourism. Future research must prioritize understanding the intricate ecological interactions and resilience mechanisms inherent to these areas. As global temperatures rise, glacial melt accelerates, influencing hydrological patterns that sustain not only these ecosystems but also downstream human populations reliant on their water resources. Multidisciplinary collaborations, encompassing climatology, ecology, and socioeconomics, are vital for crafting effective conservation policies. These approaches must incorporate sustainable tourism practices, emphasizing minimal ecological footprints while encouraging experiential learning and appreciation for high-altitude environments. Additionally, leveraging technology such as remote sensing and Geographic Information Systems (GIS) is crucial for detailed monitoring and adaptive management. Promoting global awareness of the crucial role these ecosystems play in biodiversity and climate regulation could galvanize action towards their protection. Ultimately, conservation of high-altitude landscapes stands as both an ethical duty and a strategic necessity, fostering resilience in the face of escalating environmental challenges and ensuring these poles of biodiversity persist for future generations.",long,low,abstract,3rd,future
nature_travel,narrative,plain,Grade8,Exploring the Enchanted Lake,"Today, I set off to explore the Enchanted Lake, a place whispered about among locals. It's said that the water sparkles like diamonds, catching the light in a magical way. As I arrived, the rumors proved true. The lake sat there quietly, framed by towering pines and delicate wildflowers. Birds flitted from branch to branch, chirping melodies that filled the air. I stepped closer, noticing how the water seemed to shimmer differently with each step. As I watched, a gentle breeze stirred the surface, creating ripples that danced. Moments later, a family of ducks appeared from the reeds, gliding effortlessly across the water, leaving trails in their wake. Everything about the lake was peaceful and inviting, a haven for anyone seeking a moment of calm. I found a spot on a sun-warmed rock and took a deep breath, feeling the fresh air fill my lungs. Spending time by the lake felt special, like stepping into a storybook world. It's a place not just of beauty but of stillness, where time seems to pause, letting nature's magic take over.",short,low,mixed,1st,present
nature_travel,expository,reflective,Graduate,Cultural Insights from Ancient Kiwi Migration,"The ancient migration of the kiwi across New Zealand offers rich insights into both the cultural narratives and ecological shifts that have shaped the island's history. This flightless bird, a symbol deeply embedded in Maori culture, represents resilience and adaptability, qualities essential for survival in diverse and evolving landscapes. Scholars have long sought to understand the pathways through which kiwis spread, examining fossil records and genetic data to piece together a fragmented past. By tracing these movements, scientists have gained awareness of prehistoric climate conditions and their implications for biodiversity. Moreover, the kiwi’s progression across the terrain intertwined with human migration patterns, showcasing a synergy between species and people. As Maori settled across regions, they integrated the kiwi into their stories and practices, revealing the profound relationship shared with the natural world. Their journey invites reflection on modern conservation efforts, urging a reconsideration of human-ecological connections that span millennia. The kiwi's story reminds current societies of the delicate balance between stewarding nature's gifts and respecting its autonomy. Ultimately, exploring this avian migration transcends scientific inquiry, beckoning a deeper understanding of how cultural interactions with wildlife inform a lasting legacy on both ecological and philosophical levels.",mixed,medium,mixed,3rd,past
nature_travel,descriptive,conversational,Grade8,The Jungle Rain,"The jungle rain is a symphony. It starts with a gentle patter, a whisper among the giants, as if the trees are sharing secrets. The droplets grow braver, drumming rhythmically on leaves, a jungle lullaby that sings the world to sleep. Each raindrop sparkles, catching the dim light that filters through the canopy, becoming tiny diamonds scattered across the forest floor. Vines, twisted like nature's braid, drape down elegantly, their leaves adorn themselves with teardrops. Birds chirp softly, their melodies blending with the rain, creating a harmonious concert. The air is rich with an earthy scent, it's thick, yet inviting. As the rain continues its cascade, the forest transforms, a living painting in a wash of greens and browns. Creatures big and small find shelter under the large umbrella of leafy arms, embracing the wet embrace. Here, in the heart of the jungle, the rain doesn't just fall, it tells stories of life, growth, and renewal, before slowly fading into quiet, leaving behind a glistening world, alive with the gentle kiss of rain.",short,high,concrete,3rd,present
nature_travel,process_explanation,technical,Grade12,Implementing Eco-friendly Resort Practices,"As the need for sustainable tourism grows, transitioning traditional resorts into eco-friendly havens becomes imperative. Begin by evaluating the resort's current environmental impact through comprehensive energy audits and waste assessments. Focus on reducing carbon footprints by implementing renewable energy sources, such as solar panels, which should be installed to harness natural sunlight efficiently. Develop a robust waste management system focusing on recycling and composting, aimed at reducing landfill contributions. Involve local communities in sourcing organic produce to minimize food miles, and integrate indigenous architectural techniques to ensure design harmony with the surrounding environment. Implement water conservation measures by installing low-flow fixtures and smart irrigation systems, which will maximize resource efficiency. Tailor guest activities to promote awareness of local ecosystems, embedding educational components about biodiversity and conservation in all experiences offered. This strategy not only enhances guest engagement but also amplifies the resort's commitment to environmental stewardship. Encourage feedback and adjust practices through continuous monitoring to ensure alignment with ever-evolving sustainability standards. Ultimately, by embracing eco-friendly practices, resorts can transform into leaders of environmental innovation, offering visitors enriching and responsible experiences while preserving the planet's natural beauty for future generations.",mixed,none,abstract,2nd,future
nature_travel,persuasive,plain,Undergraduate,Preserving Coastal Wetlands,"Preserving coastal wetlands is of utmost importance due to their myriad ecological functions and benefits they provide to both local communities and global biodiversity. These wetlands act as crucial buffer zones, protecting coastlines from erosion and mitigating storm damage by absorbing wave energy. They serve as vital habitats for a host of flora and fauna, many of which are endangered or endemic to these regions. Furthermore, wetlands play a significant role in carbon sequestration, locking away carbon dioxide from the atmosphere and serving as essential components in the fight against climate change. It's important to understand that the loss of such ecosystems would lead to increased vulnerability to environmental stressors and a decline in biodiversity. Efforts should be concentrated on raising public awareness about the significance of these areas, involving local populations in conservation projects, and advocating for policies that support wetland restoration and sustainable management. By investing in research and employing advanced techniques for conservation, society can foster a greater appreciation for and understanding of the value of wetlands. In doing so, wetlands can continue to provide their indispensable services, ensuring ecological balance and resilience in the face of changing global conditions. Thus, a collective commitment to preserving coastal wetlands is essential for the well-being of our planet and future generations.",long,medium,mixed,3rd,present
nature_travel,narrative,technical,Graduate,Exploring Martian Terrain,"Imagine embarking on a scientific expedition to Mars, where the primary objective is the exploration and analysis of its vast, enigmatic terrain. Equipped with sophisticated rovers and advanced analytical devices, the preliminary tasks involve landing strategically to maximize both safety and research potential. Upon successful landing, you conduct a systematic evaluation of the Martian regolith, employing spectrometers to assess material composition and detect traces of past water activity. Utilizing drone technology, the expedition enables a comprehensive survey of surrounding landscapes, capturing high-resolution imagery that aids in the delineation of geological features, such as canyons and ancient riverbeds. As you navigate this alien surface, careful planning is essential to mitigate potential challenges brought about by Martian dust storms and extreme temperature variations. Collecting rock samples becomes a meticulous procedure, utilizing cutting-edge robotic arms to secure specimens for subsequent off-world analysis. These findings, then relayed back, contribute to an ever-growing repository of data that enhances our understanding of Mars' geological history and its potential for sustaining life in the future. This endeavor embodies the spirit of interplanetary exploration, where even the smallest discoveries hold the promise of unlocking new insights into our solar system, thereby expanding the boundaries of human knowledge and possibility on an unprecedented scale.",long,low,abstract,2nd,future
nature_travel,expository,conversational,Grade8,Adventures in the Caves of Mystery,"The Caves of Mystery are truly an adventurer's dream! Carved by nature over millennia, these caves hold secrets waiting to be uncovered by curious explorers. As you step inside, your senses are greeted by the cool, damp air, and a wonderland of stalactites and stalagmites unfolds before you. These limestone formations have grown slowly, drop by drop, creating mesmerizing sculptures that seem to change with each shift of light. As your footsteps echo softly, you might hear the whispering of the wind coming from deep within the cavern, a sound like an ancient melody. Tiny streams of water trickle through the rocks, weaving around like nature's own mazes. In these caves, wildlife finds refuge; bats hang silently overhead, oblivious to the passing visitors. Guides will share tales of discovery and adventure, of explorers who first mapped these underground expanses. Each chamber feels like entering a new world, where shadows play and light dances. For those who crave exploration and discovery, the Caves of Mystery offer a journey into a realm where nature continues to marvel and inspire.",mixed,medium,concrete,3rd,present
nature_travel,descriptive,reflective,Graduate,Sunset at the Edge of the World,"At the edge of the world, where the land yields to the embrace of the vast ocean, the sunset unfolds its daily miracle in a spectacle of transcendent beauty. As the sun approaches the horizon, its descent paints the sky with a palette of intense hues, each blending seamlessly into the next. The sea, a silver mirror, captures the fiery glow, transforming its surface into a dance of shimmering light and shadow. Gentle waves cascade over jagged rocks, their rhythmic pulse a timeless lullaby that echoes the heartbeat of the earth. A gentle breeze sweeps across the landscape, carrying with it the scent of salt and the whispers of distant shores. Here, in this fleeting moment, nature weaves an artwork of ephemeral splendor, a delicate tapestry that seems to hold within it the secrets of time itself. Those who stand witness find themselves transported, their spirits momentarily unburdened by the world’s cares. As the last light dwindles and stars begin to adorn the twilight, the horizon fades into mystery, leaving behind a lingering sense of awe and connection. It is in these rare moments that the universe reveals its grandeur, and one feels profoundly tied to the gentle rhythms that guide the cosmos through its eternal dance.",long,high,mixed,3rd,past
