domain,mode,tone,reading_level,title,paragraph,style.sentence_length,style.figurative_language,style.concreteness,style.viewpoint,style.temporal_focus
everyday_scenarios,narrative,reflective,Grade12,A Surprising Family Recipe,"Back when the summer heat settled over the town, my grandmother's kitchen became a hive of culinary exploration, her small garden yielding fresh produce for our seasonal meals. One humid afternoon, as we sifted through recipes, she revealed a family secret—a hand-written card, worn with time, detailing a dish neither of us had ever prepared before. With curiosity driving us, we gathered the ingredients: ripe tomatoes, basil, garlic, olive oil, and a mysterious blend of spices stored in a small, unmarked tin. As we chopped, stirred, and laughed, the kitchen transformed, filling with a heady aroma that clung to the walls like a comforting hug. The process was as much an exercise in discovery as it was in cooking, each step guided more by intuition than instruction. With the final pinch of salt sprinkled, we tasted our creation, a burst of flavor that danced across the palate, embodying generations of life and love. That shared afternoon reminded me that recipes connect more than ingredients—they weave stories, providing threads that bind past, present, and future. Grandma’s kitchen, always a place of warmth, became the setting of a personal epiphany, underscoring the culinary legacy cherished within the family.",mixed,medium,concrete,1st,past
everyday_scenarios,expository,technical,Graduate,Urban Water Management Systems,"Effective urban water management systems are integral to ensuring the sustainable use and distribution of water resources amid expanding metropolitan populations. These systems encompass a suite of engineering and technological solutions designed to address the complexities of water supply, distribution, usage, and waste within urban settings. Critical components include modernized infrastructure for potable water treatment, advanced wastewater treatment plants, and comprehensive stormwater management strategies. Such systems must accommodate variable demand levels while adhering to stringent regulatory standards concerning water quality and environmental impact. Innovations such as the integration of smart sensors and automated monitoring solutions facilitate real-time data collection and analysis, fostering informed decision-making processes that optimize water allocation efficiencies. Furthermore, urban water management systems prioritize risk management practices, anticipating challenges posed by climate change, natural disasters, and resource scarcity. By marrying technology with eco-conscious practices, these systems aspire to not only meet immediate municipal needs but also sustain the ecological balance within urban environments, ultimately ensuring water security for future generations.",long,none,abstract,3rd,present
everyday_scenarios,descriptive,playful,Grade8,The Enchanting World of the Toy Store,"Welcome to the toy store, a wonderland bursting with color and imagination! As you step inside, you're greeted by towering shelves that seem to stretch into the sky itself. Brilliant displays flicker and blink like endless carnival lights, each aisle swirls with vibrant delights and whispered promises of adventure. Plush animals of every size and shape invite warm hugs; they sit patiently, waiting to become someone's new best friend. Action figures, poised for a battle of wits and might, line the shelves, crafting worlds of fantasy in plastic forms. The air is alive with the scent of newness, a sweet mix of rubber and possibilities. Listen closely to the low hum of distant electronic beeps, chiming in harmony with the excited chatter of young buyers exploring this paradise. Everywhere you turn, there's a new discovery waiting to be made—imagine, play, and embrace the magic of endless playtime.",short,high,concrete,2nd,present
everyday_scenarios,process_explanation,reflective,Undergraduate,The Journey of Baking Bread,"The art of baking bread, an ancient yet enduring practice, reflects a journey that engages every sense and emotion. From my initial foray into baking, I learned that crafting a loaf is less about following precise measurements and more about the relationship between the baker and the dough. It begins with gathering flour, yeast, water, and salt—each an essential component that contributes to the final product. The tactile experience of kneading allows one to feel the transition of ingredients into a smooth, cohesive entity. As the dough rests, the warmth of the kitchen facilitates fermentation, a silent transformation driven by time and patience. During baking, the aroma transcends the physical—and fills the space like a warm embrace, promising nourishment. Finally, the result—a crusty loaf with a soft interior—carries with it the effort and care invested during process. As I sliced into it, I found satisfaction not only in taste but in rediscovering the timeless connection between self and sustenance, a reminder that even simple actions hold profound depth when viewed through the lens of creation.",mixed,low,concrete,1st,past
everyday_scenarios,persuasive,conversational,Graduate,The Value of Public Parks,"Public parks, often overlooked in the rapid pace of modern life, offer invaluable sanctuaries that nurture communal vitality and personal well-being. These verdant expanses provide essential green lung spaces within our urban environments, enhancing air quality and offering biodiversity havens amidst concrete landscapes. Historically, parks have served as democratic spaces where individuals from diverse backgrounds convene without the social-class barriers that often infiltrate other public domains. With trails that invite walkers and joggers, play areas that echo with children’s laughter, and serene patches that beckon those seeking respite, parks foster both physical health and mental rejuvenation. Moreover, they host cultural events, art installations, and community gatherings that elevate social engagement, reinforcing a collective sense of identity and belonging. As we reflect on the past, the enduring presence of these spaces underscores their role as custodians of our shared heritage and stewards of future sustainability. Protecting and prioritizing investments in public parks emerges as not merely an act of environmental stewardship but as a commitment to enriching community life that transcends fleeting trends and affirms the timeless value of tranquil, open spaces amidst the urban sprawl.",long,medium,mixed,3rd,past
everyday_scenarios,narrative,technical,Undergraduate,Fixing the Leaky Faucet,"In the realm of household maintenance, undertaking the repair of a leaky faucet presents itself not as a mere task, but a confluence of technical understanding and methodical execution. My venture into resolving the persistent drip took root in the pragmatic acquisition of necessary tools—a wrench, plumber's tape, and replacement washers—each item meticulously chosen to navigate the complexities of the faucet's internal mechanisms. With these implements in hand, I approached the faucet, channeling insights garnered from both personal instinct and instructional guidelines. The procedure began by shutting off the water supply, ensuring a seamless transition into the disassembly phase without inundating the workspace. Once exposed, the intricacies of the faucet’s assembly revealed themselves; washers and seals—suspected culprits of leakage—were systematically inspected and replaced, guided by the tactile feedback of interlocking components. Throughout the process, the application of plumber’s tape reinforced connections, precluding future seepage. The quiet satisfaction of reassembling and witnessing a resolute cessation of the once relentless drip culminated in a seamless marriage of technical acumen and tangible outcome, evincing the essence of hands-on problem solving within domestic confines.",long,none,concrete,1st,present
everyday_scenarios,expository,plain,Undergraduate,Understanding Cryptocurrency,"Cryptocurrency has become a buzzword, but what does it really mean? It's a type of digital or virtual currency that uses cryptography for security, making it difficult to counterfeit. Unlike traditional money, cryptocurrencies are decentralized and usually based on technology called blockchain. This technology records all transactions in a public ledger, ensuring transparency. Popular cryptocurrencies include Bitcoin and Ethereum, each with distinct features and uses. Bitcoin, for example, is primarily a digital asset and a payment system. On the other hand, Ethereum supports decentralized applications via smart contracts. These currencies can be traded on special platforms known as exchanges. While they offer exciting opportunities, it's essential to understand the volatility and risks involved. Values can fluctuate wildly, so caution and careful research are advised before investing. Cryptocurrencies represent a transformative step in the evolution of digital finance, promising both opportunity and challenge in equal measure.",short,low,mixed,2nd,present
everyday_scenarios,descriptive,reflective,Graduate,The Solitude of the Mountain,"Turning to the mountains provides a sanctuary, a pause from the cacophony of daily existence that ceaselessly thrums in urban landscapes. As I stand at the base, enveloped in solitude, the world narrows, and an embrace of quietude envelops my senses. The ascent is a symphony, orchestrated by the crunch of gravel beneath worn boots, the whispering wind that surfs through evergreen sentinels, and the distant call of a lone bird braving the open skies. Each step taken up the slope is introspective, a retreat inwards as the vistas paint their untamed canvases all around me. The air here moves differently, purified of the rush that permeates our city-bound lives, infused instead with the crisp, untouched breath of nature. I find myself contemplating, amidst the grandeur and isolation, the essence of journeying and the moments deadened by noise, now alive with clarity. As the peak looms, crowned with a horizon awash in golden light and sky-searing splendor, I am reminded of the mountain's timeless patience. Here, time isn't counted by minutes but by the heartbeats of the earth, and for a brief span, I am simply part of its ancient rhythm.",long,high,abstract,1st,present
everyday_scenarios,process_explanation,playful,Grade12,Packing a Picnic,"Packing a picnic is an art and a delightful excuse to bask in nature’s embrace while savoring good food. Future me will be the architect of this feast, starting with a varied selection of flavors—sandwiches with a zesty kick, vibrant salads, and perhaps some sweet treats. The key lies in the artful assembly. First, select the picnic mat; it's not just a mat but a throne for alfresco dining. Then, consider the travel-friendly containers to ensure nothing gets smooshed. Don’t forget to sneak in a chilled bottle of lemonade for refreshing sips under the sun’s warm gaze. As I imagine arranging cheese with a side of grapes, I laugh, knowing I’ll craft a picture-worthy charcuterie on the grass. A good book or some music could serenade us into the afternoon. Once packed, the basket becomes a treasure chest—a portable celebration of leisure. Assembling this feast paints smiles through every meticulous detail, transforming a mere outing into an experience of dining over skies wide open.",short,medium,concrete,1st,future
everyday_scenarios,persuasive,technical,Graduate,The Necessity of Cybersecurity,"In an age marked by relentless technological advancements, cybersecurity's significance has escalated, demanding comprehensive strategies to secure information integrity and safeguard against pervasive threats. As digital footprints expand exponentially, vulnerabilities have also proliferated, necessitating robust defensive mechanisms to protect sensitive data and infrastructure. Cybersecurity encompasses multiple facets, including encryption protocols, multi-factor authentication, and vigilant monitoring processes, each contributing to a fortified digital ecosystem. It is paramount to recognize that data breaches and cyber attacks extend beyond individual repercussions, posing substantial risks to organizational operations, financial systems, and even national security. Institutions must invest in sophisticated and adaptive security architectures, leveraging artificial intelligence and machine learning to preemptively counteract potential intrusions. Additionally, fostering a culture of cybersecurity awareness among users is essential to mitigate risks associated with human error, potentially the weakest link in security chains. Thus, the commitment to cybersecurity reflects not merely a defensive posture but a strategic imperative ensuring the resilience and trustworthiness of interconnected digital realms in an era increasingly defined by virtual interdependence.",long,low,mixed,3rd,present
everyday_scenarios,narrative,playful,Grade8,The Birthday Surprise,"Imagine waking up on your birthday, expecting a normal day, when suddenly you’re whisked into a whirlwind of unexpected adventures! Your friends greet you with wide, mischievous grins and a day planned down to the minute. First stop? The amusement park. You find yourself soaring through the sky on roller coasters, your laughter mixing with the rush of the wind. Next, a picnic in the park where you discover a feast fit for kings— including your favorite chocolate cake and a treasure hunt that leads to a secret stash of gifts. As the sun dips low, casting golden hues over the landscape, a surprise awaits at the lakeside theater. You find all your favorite people cozy on blankets, ready to enjoy an outdoor movie under the twinkling stars. As the credits roll, a final burst of delight—a dazzling display of fireworks just for you— dances in the night sky, capping a day where every moment sparkled like a cherished jewel.",short,medium,concrete,2nd,present
everyday_scenarios,expository,reflective,Grade12,The Evolution of Work,"The concept of work is ever-changing, woven intricately with shifting societal expectations and technological advancements that continuously redefine the professional landscape. As you ponder your place within this evolving domain, consider how traditional office confines are giving way to more flexible remote arrangements, enabled by advancements in digital communication tools. The future may unveil a paradigm where work-life balance is reimagined, fostering environments that prioritize not only productivity but holistic well-being. Automation and artificial intelligence stand poised to revolutionize tasks, demanding a reevaluation of skills and an adaptation to roles that require creativity, emotional intelligence, and critical thinking. Furthermore, globalization continues to foster connectivity, expanding collaborative opportunities beyond geographical limitations. As work personnel becomes more diversified, cultural competence and inclusive practices are increasingly imperative to cultivating cohesive workplaces. Thus, your intentional engagement in lifelong learning will become essential, allowing you to navigate and thrive amid these ongoing transformations. The future of work embodies a vivid mosaic—dynamic and multifaceted—reflecting society's evolving values and aspirations.",long,medium,abstract,2nd,future
everyday_scenarios,descriptive,technical,Graduate,Inside a Modern Kitchen,"The modern kitchen, with its utilitarian design and advanced functionality, is a meticulously orchestrated space engineered to optimize culinary efficiency while maintaining aesthetic appeal. It is the centerpiece of contemporary homes, integrating technology with design principles to cater to diverse user needs. Upon entering such a kitchen, one notices the seamless surfaces constructed from materials like quartz and stainless steel, both chosen for their durability and ease of maintenance. State-of-the-art appliances line the walls; induction cooktops, known for precision in cooking, sit alongside convection ovens that ensure even heat distribution. Cabinets employ soft-close mechanisms to minimize noise, demonstrating thoughtful consideration towards creating a tranquil environment amid activity. The kitchen’s lighting solutions, often a blend of recessed ceiling lights and under-cabinet LEDs, are strategically placed to illuminate countertops without casting unwanted shadows. The inclusion of smart technology, from refrigerators equipped with cameras to voice-controlled mixers, further accentuates the space's commitment to innovation. As a result, the modern kitchen serves as both a practical and visionary space, embodying the convergence of functionality, form, and forward-thinking ingenuity.",long,none,concrete,3rd,present
everyday_scenarios,process_explanation,conversational,Grade8,How to Make Homemade Ice Cream,"Making homemade ice cream is super fun and easier than you might think! First, gather your ingredients: heavy cream, sugar, vanilla extract, and any flavorings you love, like chocolate chips or strawberries. Stir together your cream, sugar, and a splash of vanilla in a big mixing bowl until the sugar dissolves. Next, pour this sweet mixture into a freezer-safe container. If you have an ice cream maker, this is its time to shine. If not, no worries! Simply pop the container in the freezer, but remember to stir every 30 minutes. This stirring helps make the ice cream creamy instead of icy. Keep at it until it reaches that perfect texture you can't resist—a smooth and velvety dream. Once it's ready, scoop your homemade treat into bowls and add your favorite toppings. Share it with friends or, better yet, enjoy every delicious spoonful yourself!",short,medium,concrete,2nd,present
everyday_scenarios,persuasive,plain,Undergraduate,The Ethics of Animal Testing,"Animal testing remains a contentious issue, raising profound ethical questions about necessity, science, and empathy. Proponents argue that animal testing has played a pivotal role in medical discoveries, safeguarding human health by allowing scientists to assess the safety and efficacy of new drugs and procedures before they reach humans. However, this practice is increasingly scrutinized, with detractors citing the moral implications of subjecting animals to potentially painful experiments for human benefit. Alternatives such as cell cultures and computer simulations offer promising avenues, reducing reliance on animal models. Implementing stringent ethical standards and oversight can ensure that animal testing is conducted responsibly, minimizing suffering and promoting humane treatment whenever it becomes unavoidable. Societal values continue to evolve, reflecting a growing commitment to ethical research practices. Therefore, it is essential to balance scientific advancement with moral considerations, ensuring that compassion governs our approach to animal testing, fostering a future grounded in ethical integrity and innovative practices.",mixed,low,mixed,3rd,present
