domain,mode,tone,reading_level,title,paragraph,style.sentence_length,style.figurative_language,style.concreteness,style.viewpoint,style.temporal_focus
everyday_scenarios,narrative,plain,Grade8,Lost in the Corn Maze,"The autumn sun was setting, painting the sky in hues of orange and pink. Sam was deep within the twists and turns of the corn maze, realizing they were not as easy to navigate as they seemed. The air smelled of dried corn and earth, a reminder that the field was massive and unfamiliar. Sam took a left, then a right, but every path seemed to lead back to the same spot with the battered wooden sign. Anxiety bubbled up as the chorus of distant laughter from other wanderers grew faint, almost like a fading radio tune. Determined not to let the shadows and his imagination win, Sam pressed on with renewed determination. Finally, after what felt like an eternity, the distant glow of the entrance lights danced in the distance. Relief washed over him like a warm wave, and he paced quickly toward the exit. Emerging from the maze, Sam vowed to remember this adventure as a lesson in perseverance.",mixed,low,concrete,3rd,past
everyday_scenarios,expository,formal,Grade12,Understanding Urban Gardening,"Urban gardening represents a growing trend whereby city dwellers cultivate plants, flowers, or edibles in decidedly limited urban spaces. This practice is rooted in a desire to establish a direct connection with nature despite the constraints imposed by urban environments. Urban gardening frequently involves utilizing unconventional spaces, such as rooftops, balconies, and vertical structures, to cultivate vegetation. These gardens not only contribute to aesthetic appeal but also foster environmental benefits, including the reduction of urban heat through the provision of green canopies. Furthermore, urban gardening can serve as an educational platform, enhancing recognition of sustainable practices and local food systems. Notably, this form of gardening enables city residents to engage in ecological stewardship, promoting biodiversity and enhancing air quality within urban confines. Therefore, urban gardening embodies a synthesis of practicality and environmental consciousness, underscoring the innovative potential for urban environments to harmonize with natural ecosystems.",long,medium,mixed,3rd,present
everyday_scenarios,descriptive,technical,Undergraduate,The Intricacies of a Busy Train Station,"A bustling train station operates as a complex machine with various interrelated components functioning in unison to facilitate travel. The architecture itself is meticulously designed, utilizing spacious corridors to manage the flow of people, ticket counters strategically positioned for efficiency, and signage omnipresent to direct passengers toward differing platforms. The auditory environment is characterized by a medley of sound: the mechanical rolling of luggage wheels across tiled floors, the periodic chime announcing arrivals and departures, and an indistinct hum generated by converging conversations. Each platform is equipped with automatic doors calibrated to open in synchrony with train arrivals, ensuring crowd control and safety measures are maintained. The tactile experience, too, is diverse—from the smooth, cool surfaces of ticket machines to the textured grip of escalator railings. Together, these elements transform the station into a dynamic hub in which precision and functionality converge, facilitating the interplay of human and mechanical interaction.",long,none,concrete,3rd,present
everyday_scenarios,process_explanation,playful,Graduate,The Art of Making the Perfect Pancake,"Ah, pancakes, those fluffy disks of delight! Crafting the perfect pancake requires a touch of finesse and the wisdom of breakfast sages. First, gather your ingredients: flour, eggs, milk, a sprinkle of salt, and a dash of sugar. Begin by whisking them energetically, conjuring a smooth batter, free of rebellious lumps. Your skillet should be a blistering hot dance floor, where each dollop of batter pirouettes into a golden disc. As bubbles appear on the surface, teasing you with promises of airy interior, it becomes time to flip. With a flick of the wrist—voila!—the pancake reveals its tawny complexion, winking back at you. Resist the urge to press it; pancakes disdain such interference, preferring to rise unfettered. Once cooked to golden perfection, stack them with precision, adorning with butter that melts into rivulets and syrup flowing in amber streams. There you have it, a culinary symphony, an ode to breakfast's most tender creation. Enjoy!",mixed,high,concrete,2nd,present
everyday_scenarios,persuasive,reflective,Graduate,Importance of Digital Detox,"In today's hyper-connected world, the ubiquitous presence of digital devices has notably permeated every aspect of our lives, beckoning a pervasive need for conscientious reflection on the implications of our interactions with technology. As a constant companion to our daily routines, screens provide unbridled access to information, entertainment, and social connectivity. However, often neglected is the subtle yet profound impact of excess digital consumption on our mental and emotional well-being. It is imperative to recognize the insidious nature of digital distractions that can detrimentally affect attention spans, hinder face-to-face communication skills, and foster a sense of virtual isolation. Embracing the concept of a digital detox, a deliberate and temporary disconnection from our electronic tethering, offers more than just a respite; it fosters an opportunity to reconnect with the tangible, the personal, and the immediate. It is an antidote that nourishes mindfulness, encourages real-time experiences, and promotes the flourishing of deeper relationships with both self and others, unencumbered by the cacophony of constant digital chatter.",long,medium,mixed,1st,present
everyday_scenarios,narrative,formal,Undergraduate,A Day at the New Library,"In the near future, a day at the state-of-the-art library promises an experience replete with innovation and discovery. This newly unveiled establishment, designed to cater to the intellectual pursuits of a diverse patronage, is a modern marvel of architectural ingenuity characterized by towering glass facades and interwoven green spaces. The library's interior is a haven for voracious readers, featuring an expansive collection that spans myriad genres and languages. Visitors will find themselves immersed in a world where knowledge is both celebrated and shared, facilitated by advanced digital catalogs and interactive information kiosks. In the hushed corridors, the gentle hum of electronic cues harmonizes with the rustle of pages being turned, a testament to the library's perfect amalgamation of tradition and technology. As the sun dips beyond the horizon, casting a golden hue through the vast windows, patrons linger in cozy reading nooks, engaged deeply with texts, while the more curious minds explore dynamic workshops designed to ignite creativity and foster collaborative learning opportunities. This library, envisioned as a beacon of education and enlightenment, symbolizes the enduring importance of accessible knowledge repositories in our communities.",mixed,medium,mixed,3rd,future
everyday_scenarios,expository,conversational,Grade8,Why Recycling Matters,"Recycling is something many people talk about, but not everyone takes seriously. It's actually a simple thing we can do to help our planet. When you recycle, you turn old things like paper and plastic into new things. This saves energy because creating new products from raw materials uses up a lot more energy. It also means we can reduce the amount of trash we make. Less trash means smaller landfills and less pollution. Plus, recycling helps save important resources like trees and minerals. Think about it: if we keep using up these resources without recycling, we might run out someday. What's great is that recycling doesn't take a lot of effort. All it takes is remembering to use the right bin for your waste. Schools, homes, and offices can all do it, and it’s something you can start right now. Recycling matters because it's an easy way to make a big impact.",short,low,concrete,3rd,present
everyday_scenarios,descriptive,reflective,Graduate,A Rainy Afternoon at the Café,"On that particular drizzly afternoon, I found myself cocooned within the familiar embrace of a quaint café, the perpetually welcoming refuge against the rhythmic patter of rain. The atmosphere was a blend of aromatic coffee and the rich, warm hues of mahogany and amber light filtering softly through rain-splattered windows. Around me, the gentle murmur of patrons in quiet conversation created a tapestry of sound, punctuated intermittently by the soft clink of ceramic cups touching polished tables. As I sat, absorbed in thought, my gaze fell upon the rivulets of rain weaving intricate patterns against the glass, each droplet a small whisper of nature's artistry. The air inside was thick with the scent of freshly ground beans, mingled with the distant notes of cinnamon and sweet pastries. In this cocooned corner of the world, time unfurled lazily, each tick of the clock harmonized with the delicate cadence of the falling rain. We, the gathered souls within this earthy haven, shared a collective pause, savoring every unhurried moment enveloped by the enthralling dance between the interior’s warmth and the stormy embrace of the world outside.",long,high,mixed,1st,past
everyday_scenarios,process_explanation,technical,Grade12,How a Car Engine Works,"The process of how a car engine works is an intriguing chain of events that transforms fuel into motion. At its core, an engine operates on the four-stroke cycle: intake, compression, combustion, and exhaust. During the intake phase, air and fuel are drawn into the cylinder as the piston moves down the chamber. The compression stroke follows, with the piston ascending, compressing the air-fuel mixture tightly. Herein lies the heart of the engine's efficiency: a well-compressed mixture ignites more powerfully. As the compressed mixture is ignited by a spark from the spark plug, a tiny explosive force drives the piston back down, generating power that turns the crankshaft, setting the car in motion. Finally, the exhaust stroke expels the burnt gases from the cylinder, resetting the mechanism for the next cycle. This series of actions repetitively plays out within each cylinder of the engine, synchronizing to produce the continuous movement required to power a vehicle.",mixed,low,mixed,3rd,present
everyday_scenarios,persuasive,playful,Grade12,Why Try Journaling?,"If you have ever felt the world is swirling too fast and life feels like a rollercoaster you can’t get off, it's time you give journaling a whirl. Imagine having a corner of your world where you can scribble freely, unjudged, diving into the vortex of your thoughts and dreams. Journaling is like having a conversation with a best friend who speaks the language of your soul. To make it more intriguing, think of your journal as a time capsule, where today’s musings become tomorrow’s echoed memories. Whether you need to pour out your heart or craft imaginative tales, journals are as patient as a sage. Grab a pen and let your thoughts dance across the page like fireflies on a summer night, casting fleeting glimmers of clarity. Besides, writing regularly can sharpen your mind and keep your creativity on its toes. So, ready to embark on this paper-bound journey? Start jotting down those thoughts; the pages await your very own kind of magic.",short,medium,mixed,2nd,present
everyday_scenarios,narrative,conversational,Graduate,The Baking Venture,"Baking has always held an alluring promise, leading me to indulge in the art of crafting bread from scratch. There is something inherently satisfying about coaxing together flour, water, yeast, and salt, and watching it transform into something nourishing. Today, as I embark on this venture, I feel the light powdery texture of flour between my fingers, measuring out each ingredient with care. The kneading process demands patience, muscles working rhythmically to create the desired elasticity. I notice how the dough's texture changes under my hands, becoming smooth and pliable. After leaving it to rise, anticipation builds. Watching the dough swell with life is akin to observing a slow-motion miracle. Once it's ready, I slide it into the oven, and the kitchen fills with a fragrance that evokes warmth and homeliness. Sitting and waiting for it to bake, I reflect on how the process mirrors a journey—requiring time, dedication, and the balancing of elements to create something wonderful. Finally, as I slice through the crust, revealing the soft interior, there's a momentary pause where all efforts culminate into a tangible expression of creation, blending patience with tactile delight. This simple act of baking reveals itself to be a dance between precision and intuition, each loaf a testament to the hands that shaped it.",mixed,medium,concrete,1st,present
everyday_scenarios,expository,reflective,Undergraduate,The Future of Commuting,"As urban landscapes continue to evolve, the future of commuting emerges as a pivotal component in shaping sustainable cityscapes. Anticipating the intricacies of future mobility requires a departure from conventional practices, envisioning systems that prioritize efficiency and environmental stewardship. Emerging technologies, such as autonomous vehicles and smart public transport systems, stand poised to redefine the commuter experience. These innovations promise to alleviate congestion, reduce environmental impacts, and enhance accessibility—a critical response to urbanization's pressing challenges. Moreover, the integration of renewable energy sources into transportation infrastructures represents a significant stride towards lowering the carbon footprint of daily commutes. In this envisioned future, public transit becomes more integrated with urban designs, harmonizing with pedestrian and cycling pathways to foster healthier lifestyle choices while diminishing reliance on personal vehicles. Thus, as cities prepare for this transformative journey, embracing these advancements presents an opportunity to revolutionize how inhabitants interact with their surroundings, cultivating a more resilient urban ecosystem.",long,low,abstract,3rd,future
everyday_scenarios,descriptive,plain,Grade12,The Neighborhood Park,"Nestled between bustling avenues and high-rise buildings, the neighborhood park stands as an unassuming green gem, providing respite and leisure to its visitors. The park comprises a vast stretch of manicured lawns where families and friends lay out picnic blankets or toss frisbees under the expansive canvas of the sky. Tall trees pepper the landscape, their branches offering welcome shade to those who seek solace beneath them. The garden area is meticulously designed with bursts of colorful flowers, arranged thoughtfully, inviting passersby to appreciate their beauty. A winding path weaves through the park, accommodating joggers, cyclists, and casual strollers alike, each pace resonating with the natural rhythm of the environment. Playgrounds echo with the laughter of children navigating slides and swings, adding a liveliness to the air. Small ponds, inhabited by ducks and lined by stone benches, offer contemplative moments for those inclined toward quiet reflection. Together, these elements create a harmonious, ever-evolving tableau—the park, a communal sanctuary—continually drawing the community together in its gentle embrace.",long,none,concrete,3rd,present
everyday_scenarios,process_explanation,formal,Grade8,How to Plant a Seed,"Planting a seed is an elementary task that plays a crucial role in fostering life and growth in gardens or planters. The process begins with selecting the appropriate seed for the desired plant or flower, ensuring it suits the climate and soil conditions of the intended location. Once the choice is made, prepare the soil by loosening it with a small garden tool such as a trowel, which allows the roots to penetrate and access nutrients. Afterward, dig a shallow hole and place the seed inside, covering it gently with the enriched soil, ensuring it is not buried too deep or left exposed. Watering the seed is vital; it needs to be kept moist, but overwatering should be avoided as it can drown the fragile sprout. Additionally, positioning the planter or choosing a garden spot that receives an adequate amount of sunlight is crucial for the seed's development, encouraging photosynthesis. As the days progress, patience becomes essential, because observing the first sprout breaking through the soil marks the beginning of a plant's journey toward maturity.",mixed,low,concrete,3rd,future
everyday_scenarios,persuasive,technical,Undergraduate,The Case for Renewable Energy Use at Home,"Advocating for the integration of renewable energy within residential domains requires an understanding of both the ecological and economic benefits promised by such endeavors. Principally, renewable energy technologies, including solar panels and wind turbines, offer sustainable solutions that significantly reduce carbon footprints by harnessing inexhaustible resources. These technologies provide clean energy alternatives that can mitigate the adverse effects of fossil fuel consumption, directly contributing to broader community goals of reduced greenhouse gas emissions. From an economic perspective, the deployment of residential renewable energy systems can lead to substantial utility savings, enabling households to achieve greater energy independence over time. Furthermore, advancements in technology have improved the accessibility and affordability of renewable energy options, facilitating broader participation among homeowners. Therefore, adopting renewable energy not only aligns with environmental stewardship but also serves as a pragmatic investment strategy. Households that transition to such systems may benefit from incentives and tax credits, further enhancing the financial viability of these choices. Consequently, the case for renewable energy use at home underscores a confluence of environmental responsibility and economic prudence, advocating for a shift that promises enduring benefits.",mixed,low,abstract,3rd,present
everyday_scenarios,narrative,technical,Grade12,The Mechanic's Busy Day,"In the confines of the bustling auto repair shop, the day began like clockwork for Jacob, the seasoned mechanic, whose expertise with engines and machinery was both respected and relied upon by the local community. Within the garage's cavernous interior, numerous vehicles awaited diagnostic tests and repairs, each presenting a unique mechanical puzzle to be deciphered. Jacob set to work beneath the lifted hood of a sedan, his hands deftly navigating the labyrinthine network of wires and components. As he progressed through his tasks, he meticulously logged details in the workshop's registry, documenting the intricacies of each malfunction encountered. Throughout the day, the ambiance oscillated with the clattering of tools, the revving of engines undergoing calibration, and sporadic interactions with clients, all contributing to a symphony of industrious activity. The afternoon sun cast elongated shadows across the garage floor, an indicator of the day's passage as Jacob adjusted a stubborn carburetor or replaced a worn timing belt. By twilight, when the shop doors finally closed, Jacob reflected upon the meticulously resolved mechanical challenges, content in the knowledge that each completed task contributed to the smooth operation of the vehicles entrusted to his care, and the unwavering commitment to precision and excellence that underscored his profession.",long,low,concrete,3rd,past
everyday_scenarios,expository,playful,Grade8,The Fun of Collecting Stamps,"Stamp collecting sounds a bit old-fashioned, doesn't it? But hold your horses! This delightful hobby is a colorful passport to history and creativity. Picture opening that album and exploring different countries and eras through tiny works of art. Each stamp is a miniature story waiting to be told. Some depict majestic animals while others showcase famous events or noteworthy people. The thrill of spotting a rare stamp in a pile is like finding treasure. Plus, stamps come in all sorts of colors and shapes, each bringing its own charm. But the most exciting part? The chase! Tracking down a stamp missing from your collection is a fun adventure. It's like being a detective, piecing together your own little puzzle. So, next time you come across a stamp, don't just shrug it off. Let its vivid imagery inspire you, and who knows, it might just spark your own philatelic journey, opening a window to the world's vibrant tapestry.",short,medium,mixed,2nd,present
everyday_scenarios,descriptive,conversational,Grade12,Walking Through the Farmers' Market,"Stepping into the farmers' market is like entering a festival for the senses. Rows of stalls brim with colorful arrays of produce, each display a showcase of the season's bounty. You can hear vendors enthusiastically promoting their goods, voices mingling with the laughter of families exploring the outdoor aisles. The scent of fresh herbs wafts through the air, mingling with the smoky undertones from the nearby grilling station. As I wander among the vendors, the vivid yellows of sunflowers catch my eye, towering like floral suns. My fingers run over the rugged skin of a squash while I inspect a basket filled with ripe berries, their fragrance sweet and inviting. Every turn introduces a new delight—crumbly cheeses from a local dairy, jars of golden honey, and crusty loaves of bread still warm from the oven. It's not just a market; it's a lively tapestry, a gathering spot where the community thrives and connects over shared appreciation for nature's treasures.",short,medium,concrete,1st,present
everyday_scenarios,process_explanation,plain,Graduate,The Art of Brewing Coffee,"Brewing the perfect cup of coffee involves more than just adding hot water to ground beans; it’s an art form embraced by enthusiasts around the world. Begin by choosing high-quality coffee beans and grinding them to a consistency suited to your brewing method, whether it be French press, drip, or espresso. The water used should be filtered and heated to optimal temperatures, typically between 195 and 205 degrees Fahrenheit, to extract the best flavors. Measure the ground coffee, adjusting the ratio based on personal preference for strength—often a standard is about two tablespoons per six ounces of water. During the brewing process, time becomes crucial; the immersion or drip time affects the extraction quality, contributing to notes of bitterness or acidity. Ensure your equipment is clean to avoid undesired lingering flavors. As the coffee brews, its aromatic profile should blossom, indicating its readiness. Once complete, pour and savor your creation, noting its fragrance, texture, and taste profusion—every sip reflecting a carefully monitored process that connects you intimately with each brew.",mixed,low,concrete,2nd,present
everyday_scenarios,persuasive,formal,Undergraduate,The Benefits of Learning a Second Language,"In the context of an increasingly interconnected global society, the acquisition of a second language should be perceived not only as an asset but as a critical component of personal and professional development. Engaging with a foreign language enhances cognitive abilities, promoting analytical skills and improving memory retention. Furthermore, multilingual individuals often exhibit heightened cultural awareness, allowing them to navigate diverse social contexts more effectively. As business becomes predominantly global, bilingualism can broaden career prospects, granting a competitive advantage in the job market. The ability to communicate in multiple languages fosters deeper connections across cultural divides, promoting community and collaboration in international ventures. Additionally, with technology continuously evolving, incorporating language learning applications can facilitate a more immersive and interactive educational experience. Looking toward the future, embracing language diversity is not merely embracing communication—it is embracing a worldview conducive to innovation and adaptability. Thus, learning a second language offers inestimable benefits that extend far beyond mere words, embodying an investment in both personal growth and global harmony.",mixed,medium,abstract,3rd,future
