domain,mode,tone,reading_level,title,paragraph,style.sentence_length,style.figurative_language,style.concreteness,style.viewpoint,style.temporal_focus
nature_travel,process_explanation,formal,Undergraduate,The Art of Japanese Garden Design,"The art of Japanese garden design embodies a delicate balance of simplicity, asymmetry, and natural beauty, creating an immersive experience that transcends mere aesthetics. To create an authentic Japanese garden, one must first understand the philosophy that underpins its design: the harmonious integration of natural elements to evoke tranquility and reflection. Essential components include stones, water, plants, and pathways, each selected with intentionality to mirror nature's beauty and rhythm. Stones are placed symbolically, often representing mountains or islands, and serve as structural anchors within the garden. Water, in the form of ponds, streams, or even simple stone basins, represents purity and the flow of life, reflecting the sky's expanse and the passage of time. Japanese maples, cherry blossoms, and mosses contribute to the shifting hues and textures, creating a dynamic landscape that changes with the seasons. Pathways, often composed of stepping stones or gravel trails, guide visitors through the garden, encouraging mindfulness and a slow, contemplative journey. The incorporation of elements such as lanterns and teahouses further enriches the sensory experience, offering spots for pause and reflection. Ultimately, Japanese garden design fosters a serene environment where nature and human presence intertwine, offering a haven of peace and introspection amidst the bustle of modern life.",long,medium,abstract,3rd,present
nature_travel,persuasive,playful,Grade12,Adventure Awaits on the Great Ocean Trail,"Why not take a leap into the wild and explore the Great Ocean Trail? Picture this: salty breezes tousling your hair, the symphony of waves crashing like an applause as you make your way along a path kissed by the sea. This trail offers more than just exercise; it’s an invitation to shake hands with the elements, a call to alchemy where every corner turned reveals a new world, one where land and ocean indulge in an endless dance. You'll tread where the cliffs stand as staunch guardians against time's restless whispers, hiding treasures only the keen-eyed discover. As birds soar overhead, you might find your thoughts stretching like wings, taking flight just as you round a bend to catch a sunset that melts into the horizon. Whether you’re seeking a peaceful escape or a heart-pumping adventure, the Great Ocean Trail extends its arms wide open, ready to embrace wanderers with tales only heard by those who venture its path. So go on, let curiosity and the promise of the unknown guide your next weekend whimsy. The trail awaits your footprints, ready to etch them into its story, a masterpiece waiting for your part. Adventure and the great outdoors are calling—don’t let them go to voicemail!",mixed,high,concrete,2nd,present
nature_travel,narrative,conversational,Undergraduate,The Watchtower on the Island,"On a solitary island stood an old watchtower, a sentry against time and tide. Its stones were weathered, kissed by sea spray, yet resolute against the sea's relentless embrace. Every day, the island played host to explorers. Today, a curious group of friends stumbled upon it, their adventure driven by the allure of mystery. Climbing the spiraling stairs, they marveled at carvings etched into the walls, centuries-old secrets whispered by the wind. Emerging at the top, they were greeted by a panorama of rolling waves teeming with life. Crimson sun melted into the horizon, casting a golden path across the water. Gulls spun in the air, serenading the day's end. One friend closed their eyes, breathing in the crisp salt-laden air, feeling connected to generations of souls who once stood sentinel here. In this twilight, the watchtower was more than stone and mortar; it was stories woven into existence. They lingered awhile, losing track of time before descending, carrying with them a piece of the island's spirit, a memory as enduring as the watchtower itself.",short,medium,concrete,3rd,present
nature_travel,expository,plain,Graduate,Sustainable Tourism in Fragile Ecosystems,"Sustainable tourism in fragile ecosystems will increasingly demand innovative approaches that balance environmental preservation with economic development. These ecosystems, whether coral reefs or arid deserts, possess distinctive biodiversity that requires careful management to ensure longevity. Future strategies will likely encompass the adoption of eco-friendly practices, such as renewable energy utilization and waste minimization, to reduce tourism's ecological footprint. Moreover, involving local communities in tourism planning and decision-making can empower stakeholders and enhance cultural heritage conservation. This practice not only fosters environmental stewardship but also ensures that economic benefits circulate within the host communities, promoting inclusive growth. Technological advancements will play a pivotal role in monitoring environmental changes and managing tourist flows to prevent ecological degradation. Implementing virtual tourism experiences could offer an alternative, providing individuals with immersive insights into these environments without physical intrusion. The success of sustainable tourism hinges on the synergistic cooperation of governments, industry professionals, and tourists, all of whom have a collective responsibility to protect the planet's natural treasures for future generations. Ultimately, by embedding sustainability as a core value in tourism frameworks, society can secure a harmonious coexistence with nature while fostering economic resilience.",long,low,abstract,3rd,future
nature_travel,descriptive,formal,Undergraduate,Majestic Fjords of Scandinavia,"Venturing into the majesty of Scandinavia’s fjords unfolds a landscape where nature wields its brush to create surreal yet tangible beauty. These deep, glacial valleys, carved by the indomitable force of ice ages past, stretch like fingers of the sea into the rugged hinterlands. Towering cliffs rise abruptly from tranquil azure waters, their craggy surfaces softened by an ever-present mist that weaves stories of ancestral lands. As the sun drifts gently across the sky, light dances upon the water, transforming the surface into a shimmering tapestry of gold and silver. Waterfalls descend in graceful arcs from dizzying heights, their cascades filling the air with a perpetual symphony of motion and sound. Sailboats, resembling delicate paper cut-outs, navigate these waters, dwarfed by the imposing grandeur surrounding them. The fjords' serene silence is punctuated only by the distant call of seabirds wheeling overhead, as they soar through the crisp, invigorating air. Here, nestled within these natural cathedrals, every element combines to create an ethereal atmosphere that resonates deeply within the soul, inviting contemplation and a profound appreciation for the timeless power of the natural world.",long,medium,concrete,3rd,present
nature_travel,process_explanation,conversational,Grade8,Preparing for a Day at the Beach,"Getting ready for a day at the beach can be simple and fun if you follow a few easy steps. First, pack the essentials! You'll want to grab your swimsuit, towel, and sunscreen to keep your skin safe from the sun. Don't forget a hat and sunglasses; they'll help shield you from the bright rays. Next, think about bringing a picnic. A cooler with some sandwiches, fruit, and plenty of water will keep you energized and hydrated throughout the day. Then, decide what activities you might enjoy. Packing a frisbee or a beach ball can make for endless fun, and a book is perfect for those relaxing moments. Once you're all packed, choose the best spot for your beach day. Finding a place with enough shade can be a great idea too, especially during the hottest parts of the day. Lastly, practice beach safety by keeping an eye on the tides and always swim with a friend. With these simple steps, you'll be ready to enjoy the sun, sea, and sand for a day filled with fun and adventure!",mixed,low,mixed,2nd,present
nature_travel,persuasive,technical,Undergraduate,Investing in Rainforest Conservation,"Investing in rainforest conservation must be prioritized due to its critical role in global biodiversity and climate regulation. Future strategies should emphasize reducing deforestation through innovative sustainable practices. Implementing carbon markets can provide financial incentives to protect these vital ecosystems. Encouraging reforestation projects can regenerate lost habitats and species. Integrating advanced remote sensing technologies will enhance monitoring and reporting, ensuring transparency. Collaboration between governments, NGOs, and businesses accelerates progress. Society must appreciate rainforests as invaluable natural capitals, promoting educational programs to increase awareness. Fostering research on eco-system services can uncover untapped potentials that benefit both nature and mankind. Thus, strategic investment aligns ecological preservation with economic growth, ensuring that rainforests continue to thrive and support life on Earth.",short,none,mixed,3rd,future
nature_travel,narrative,reflective,Grade12,A Journey through the Whispering Path,"In the heart of the ancient forest, a narrow path wound its way like a ribbon threading through the emerald tapestry of trees. I embarked on this solitary walk to seek solace in nature's embrace, cradled by the towering giants that lined the trail. Each step resonated with the soft rustle of leaves, a murmur that seemed to whisper secrets of ages past. Sunlight filtered through the canopy above, casting dappled patterns on the forest floor, where tiny flowers peeked from beneath a carpet of moss like jeweled secrets. A gentle breeze carried with it the scent of earth and pine, a cathedral of sensory delight that awakened a deep sense of serenity within me. Birds flitted overhead, their songs melding into a melodious chorus that harmonized with the forest's breath. As I journeyed deeper, the world beyond seemed to fade, replaced by the timeless rhythm of my surroundings. Pausing by a tranquil stream, I became immersed in the symphony of water sliding over stones, a mesmerizing dance of sound and motion. Here, I found the peace I sought, wrapped in the forest's eternal whisper, a reminder of the interconnectedness that binds us to the natural world. It was in those moments of profound stillness that I understood the path was more than a trail through trees; it was a journey inward, a reflection of the soul's quest for harmony within the embrace of nature.",long,high,mixed,1st,past
nature_travel,expository,playful,Grade8,Secrets of the Coral Reef,"Have you ever wondered what life is like beneath the ocean's surface? The coral reef is like a bustling underwater city full of wonders. Imagine a place where fish, each as colorful as the rainbow, dart in and out like busy commuters. Coral structures form skyscrapers, providing homes for all kinds of sea creatures. As you explore, you'll spot starfish chilling on the sandy ""streets"" and sea turtles gracefully gliding by. The reef is an endless maze of beauty and surprises! However, just like any city, it needs care and respect. Harmful activities can damage these delicate ecosystems. That's why understanding how to protect them is important. By being aware and respectful, you help ensure that the reef remains a vibrant, living world for future generations to discover and enjoy. So next time you think of the ocean, remember the coral reef and the hidden secrets it holds.",short,low,concrete,2nd,present
nature_travel,descriptive,technical,Graduate,The Structure of Mountain Ecosystems,"Mountain ecosystems present a fascinating complexity characterized by vertical stratification and climatic diversity. This structure is predominantly influenced by elevation, which dictates temperature and precipitation gradients observable from base to summit. Beginning at lower altitudes, you'll find deciduous forests rich in biodiversity, where species exhibit specific adaptations to humid conditions. Progressing upward, the forest transitions to coniferous trees, which demonstrate remarkable resilience to colder climates and reduced soil fertility. Above the treeline, alpine meadows take over, featuring a profusion of herbaceous plants that endure short growing seasons and limited nutrient availability. This zonation is crucial for supporting distinct life forms, from large herbivores like mountain goats to specialized insect pollinators. Glacial formations and rock outcrops are common at the highest elevations, offering harsh environments that test the survival skills of pioneer species, such as lichens and mosses. Understanding these ecological layers is vital for scientists, as they reflect interactions between biotic and abiotic factors that define the resilience and sustainability of mountain ecosystems.",long,none,concrete,3rd,present
nature_travel,process_explanation,reflective,Grade12,Exploring River Kayaking,"Venturing into the world of river kayaking presents an exhilarating challenge that marries the thrill of exploration with the serenity of nature. Before embarking on this aqueous journey, you will need to familiarize yourself with the essential skills and safety measures required for a rewarding experience. Begin by acquainting yourself with basic paddling techniques, ensuring a stable grip and smooth strokes that harmonize with the river’s flow. Choosing the right kayak, one appropriate for the river's class, will be fundamental to maneuvering with confidence and control. As you become adept in reading water currents, you will learn to identify eddies and obstacles, gaining an understanding of how they interact with your vessel's path. Embark with a spirit of curiosity, allowing yourself to be guided by the river's meanders as it carves through valleys and forests. Embrace the challenge as an opportunity for introspection; the river teaches patience and adaptability, rhythmically leading you through calm stretches and turbulent rapids alike. In the future, seasoned by experience, you may find that the river has etched its knowledge into your being, leaving a lasting impact on your appreciation for the delicate balance of the natural world.",long,low,mixed,2nd,future
nature_travel,persuasive,reflective,Graduate,Fostering Connection through Nature Retreats,"In a world increasingly dominated by digital interactions, carving out time for nature retreats offers an invaluable opportunity to foster deeper connections among individuals and with the natural world itself. These retreats provide a space where the frenetic pace of modern life can be momentarily suspended, allowing participants to engage in the simplicity and tranquility of nature. Research has consistently shown that immersion in natural environments enhances mental well-being, reducing stress and invigorating creativity and empathy. The retreat experience can act as a catalyst for transformation, encouraging reflection on personal values and rekindling a sense of community among attendees isolated by screens and schedules. Facilitating meaningful encounters with untamed landscapes reminds us of our inherent interdependence with nature, a relationship often overshadowed by urbanization. Consequently, nature retreats can serve as vital educational platforms, raising awareness about environmental sustainability and stewardship. As they cultivate appreciation for the fragile beauty and delicate balance of terrestrial and aquatic ecosystems, these retreats inspire a sense of responsibility toward preserving such environments. Ultimately, nature retreats offer more than respite; they are a profound reconnection with the essence of life itself, fostering a commitment to nurturing both our inner landscapes and the world we inhabit.",long,medium,abstract,3rd,present
nature_travel,narrative,playful,Grade8,The Secret Garden Adventure,"Today was no ordinary day; it was the day I stumbled upon the Secret Garden! It all started when I was exploring the woods behind my house, curiosity tickling my imagination. As I ventured further, the trees began to whisper tales of old, fueling my sense of adventure. Suddenly, I found myself in front of a large ivy-covered gate, veiled in mystery. With a twist of the weathered iron handle, the gate creaked open, revealing a garden that seemed almost magical. Wildflowers bloomed in kaleidoscopic colors, buzzing with bees that danced joyfully from petal to petal. In the center, a fountain sang with the water’s laughter, while butterflies flit about like playful sprites. A patch of red poppies stretched like a fiery carpet under the sun. The air was filled with a sweet aroma of blooming jasmine, and every corner of the garden burst with life and color. Giggling with excitement, I plopped down amongst the daisies, feeling as if I had discovered a slice of paradise. Here, time seemed to stop, leaving me alone with nature's secrets, hidden away in this delightful sanctuary. It was an adventure I would never forget, a treasured memory to wrap up and carry with me everywhere.",mixed,high,concrete,1st,present
nature_travel,expository,technical,Undergraduate,The Mechanics of Coral Bleaching,"Understanding the mechanics of coral bleaching will become increasingly vital as climate change impacts marine ecosystems. Coral bleaching occurs when corals, stressed by changes in conditions such as temperature, light, or nutrients, expel the symbiotic algae living in their tissues, causing them to turn white. The relationship between coral and algae is mutually beneficial; algae provide corals with nutrients through photosynthesis, while corals offer shelter in return. With rising ocean temperatures, especially due to global warming, this symbiosis becomes unstable. Prolonged exposure to stress factors disrupts this symbiotic relationship, leading to weakened coral structures and increased vulnerability to disease. Monitoring and predicting bleaching events will rely on advancements in remote sensing technologies and climate modeling. The development of resilient coral strains through selective breeding techniques may provide a pathway to mitigate impacts, allowing adaptation to dynamic environmental changes. Collaborative conservation efforts that incorporate these strategies are crucial for preserving coral reef biodiversity. By fostering understanding and action, scientists and conservationists aim to maintain coral reef ecosystems' ecological functions, ensuring their survival in the face of imminent challenges.",mixed,none,mixed,2nd,future
nature_travel,descriptive,plain,Grade12,The Desert's Edge,"At the desert’s edge, the landscape transitions from rocky outcrops to vast expanses of sweeping sand dunes. These dunes rise sharply, spreading as far as the eye can see, creating ever-shifting patterns shaped by the wind's relentless whisper. Vegetation clings to life here, where cacti stand like silent sentinels against the sun-bleached sky. Small desert creatures, like lizards and beetles, scuttle across the arid ground, leaving intricate trails that crisscross the sands. A mirage appears, shimmering on the horizon, a liquid illusion in a thirsty land. The air is dry, filled with the scent of sun-baked earth. In the distance, rocky mountains form a protective barrier, their shadows stretching long as the sun dips lower. It’s a harsh yet breathtaking scene, where life finds a way to thrive against the odds, creating an environment both desolate and beautiful.",short,medium,concrete,3rd,present
nature_travel,process_explanation,playful,Grade8,The Art of Birdwatching,"Birdwatching can turn a simple walk into an exciting adventure, and it's easier than you might think to start! Just grab a pair of binoculars and maybe a little notebook to jot down discoveries. Head to your nearest park or even your backyard, where birds of all kinds make their homes. Listen carefully; birds often sing before you see them, their songs guiding you to their hidden places. In the future, as you become acquainted with the songs and silhouettes, spotting a rare bird can feel like finding a hidden treasure. You'll learn to identify birds by their distinct features: the vivid flash of a cardinal's red feathers or the delicate flutter of a sparrow's wings. Birdwatching is about patience and observation, where time slows and every moment is an opportunity to learn. Before long, you might even be recognizing migratory patterns or creating your own birding journal filled with sketches and stories. So get ready for a journey into the world of feathers and flight, a delightful hobby that connects you with nature in the most joyful way!",mixed,medium,mixed,2nd,future
nature_travel,persuasive,formal,Graduate,Expanding Wilderness Protection for Biodiversity,"Expanding wilderness protection is a rapidly escalating imperative for biodiversity conservation, demanding immediate attention and action. These protected areas, characterized by unimpaired ecosystems where natural processes reign, are vital sanctuaries for countless species at risk of extinction due to habitat loss and human encroachment. Biodiversity, acting as a linchpin in maintaining ecological stability and resilience, requires vast, undisturbed landscapes to thrive effectively. Current research underscores the profound interconnections within ecosystems, where each species serves a critical role in maintaining balance. By designating additional protected regions, the connectivity between existing wilderness areas can be enhanced, promoting genetic diversity and species migration, essential for adaptation to environmental changes. The role of wilderness protection extends beyond preservation, serving as natural laboratories for scientific exploration and offering insights into ecosystem functions and climate change impacts. Furthermore, protected wilderness areas provide invaluable ecosystem services, including carbon sequestration, water purification, and nutrient cycling, which are indispensable for planetary health. By extending the reach of protective measures, society can ensure the continuity of these essential natural processes, thus securing biodiversity and reinforcing the planet’s ecological framework for future generations.",long,medium,abstract,3rd,present
