domain,mode,tone,reading_level,title,paragraph,style.sentence_length,style.figurative_language,style.concreteness,style.viewpoint,style.temporal_focus
everyday_scenarios,process_explanation,technical,Graduate,The Manufacturing Workflow,"The manufacturing workflow encompasses a series of precisely coordinated processes designed to convert raw materials into finished goods, streamlining production efficiency and maintaining quality control. It begins with a detailed analysis of raw material allocation, followed by automated and manual processes, including assembly, fabrication, or molding, determined by the product's nature. Workstations are systematically organized to minimize downtime and optimize production flow, implementing lean methodologies and just-in-time practices. Quality assurance ensures defect reduction through rigorous inspection and testing phases. Supply chain integration connects logistics, ensuring that materials and finished goods transition seamlessly throughout distribution channels. In an increasingly competitive market, automation and technology integration continue to refine these processes, yielding resource-efficient and sustainable manufacturing practices.",long,none,abstract,3rd,present
everyday_scenarios,process_explanation,technical,Graduate,Agricultural Irrigation Systems,"Modern agricultural irrigation systems are designed to optimize water use and increase crop yield efficiency. These systems, including drip, sprinkler, and surface irrigation, are selected based on crop type, climate, and soil conditions. Implementation begins with an assessment of the area’s topology and water resources, followed by the installation of delivery systems, which precisely distribute water through pipelines and emitters. Automation technology plays a pivotal role, using sensors and controllers to regulate water flow and enhance irrigation schedules, adapting to weather patterns and soil moisture levels. This systematic approach reduces water wastage, promoting sustainable agricultural practices essential for global food security amidst climatic challenges.",mixed,none,concrete,3rd,present
everyday_scenarios,persuasive,plain,Undergraduate,Value of Learning New Languages,"Learning a new language broadens our horizons beyond imagination, offering enriching experiences and opportunities. As a powerful tool for communication, speaking multiple languages deepens our understanding of different cultures, fostering empathy and connection. Mastering another tongue enhances cognitive abilities, such as problem-solving and memory, while boosting our adaptability in a globalized world. Language skills open doors to international experiences, whether in careers, travel, or personal relationships. Despite the challenges inherent in mastering a new language, the rewards are manifold, transforming not only our personal growth but also social cohesion and mutual respect among diverse communities. Delving into language learning boosts both individual and collective human development.",mixed,medium,abstract,1st,present
everyday_scenarios,persuasive,plain,Undergraduate,Embracing Sustainable Living,"Embracing a sustainable lifestyle is crucial for preserving our planet's resources and nurturing a healthy environment for future generations. As individuals, we can make impactful changes by adopting eco-friendly practices, such as reducing waste, minimizing energy consumption, and supporting renewable energy sources. Transitioning to sustainable living does more than benefit the environment; it also promotes personal responsibility and reduces cost over time, contributing to improved well-being. By choosing sustainable products and supporting environmental initiatives, our collective effort can drive significant change in global ecosystems. Understanding our role within this interconnected web empowers us to cultivate a harmonious relationship with the planet, ensuring its legacy for generations to come.",long,none,abstract,1st,present
everyday_scenarios,persuasive,plain,Undergraduate,The Benefits of Mindfulness,"Mindfulness offers a path to mental clarity and emotional well-being, essential in today’s fast-paced world. Through mindful practices such as meditation and deep breathing, we can reduce stress and enhance focus, increasing our productivity and quality of life. Mindfulness encourages living in the moment, allowing us to appreciate life’s simplicity and beauty. These practices have been linked to improved mental health, combating anxiety and depression by fostering resilience and self-awareness. Embracing mindfulness doesn't require much time and can be integrated into daily routines, offering profound benefits for both the mind and body. By cultivating mindfulness, we embark on a journey toward a more balanced and connected life.",short,low,abstract,1st,present
everyday_scenarios,persuasive,plain,Undergraduate,The Impact of Volunteering,"Volunteering serves as an indispensable means to effect positive change within communities while enriching our personal lives. By dedicating our time and skills, we contribute to addressing societal issues, supporting vulnerable populations, and strengthening communal bonds. Beyond altruism, volunteering offers opportunities for personal growth, from developing new skills to broadening social networks. It allows individuals to connect with diverse groups, fostering empathy and cultural understanding. Despite the challenges of committing time and effort, the rewards resonate deeply. As we give back, we create an environment where humanity thrives in its compassion and understanding. Volunteering boosts morale and helps forge resilient societies capable of addressing challenges collectively.",mixed,medium,mixed,1st,present
everyday_scenarios,persuasive,plain,Undergraduate,The Need for Digital Literacy,"In a world increasingly driven by digital technology, the need for digital literacy has never been more critical. Digital literacy encompasses the ability to navigate, evaluate, and create information using a range of digital technologies. It empowers individuals, offering skills needed for efficient communication and access to vast realms of knowledge. Fostering digital literacy involves more than mere technological proficiency; it requires critical thinking and ethical consideration in digital environments. By embracing digital literacy, individuals equip themselves with essential tools for academic, professional, and personal success, navigating the digital landscape with confidence and competence, ensuring active participation in an evolving digital society. Promoting digital literacy enhances societal growth and interconnectedness.",long,high,mixed,3rd,present
everyday_scenarios,narrative,conversational,Graduate,The Unexpected Gift,"In a cozy, book-lined coffee shop nestled in the city's bustling heart, Ella sat quietly sipping her latte, watching the pulsating energy of life flow by through the large bay window. It was rare moments like these, with the comforting aroma of roasted beans enveloping her, that allowed her to reflect and unwind. Suddenly, her reverie was interrupted when a stranger approached and, with a warm smile, handed her a small gift-wrapped package. Bewildered yet intrigued, Ella accepted the unexpected offering with gratitude, her curiosity piqued by the stranger's kind gesture. Peeling back the delicate wrapping, she found a charming little bookmark with a vivid depiction of a starry night, reminiscent of Van Gogh's brushstrokes. Tucked inside was a note, expressing a simple wish for her to carry on her dreams, mirroring the twinkling stars. Touched by this random act of kindness, Ella placed the bookmark within her novel, feeling her spirit buoyed by this gentle reminder of human connection's profound beauty.",long,medium,mixed,3rd,past
everyday_scenarios,narrative,conversational,Graduate,The Unexpected Garden,"On an otherwise ordinary morning, Maya awoke to a peculiar sight unfolding just outside her window. Overnight, what once stood as barren soil in the neglected patch beneath her balcony had transformed into a vivid explosion of wildflowers in vibrant hues of purple, yellow, and red. The discovery was both perplexing and delightful, having occurred seemingly by nature's whim, as Maya had not planted a single seed. Compelled by the garden's unexpected appearance, she stepped onto the balcony, allowing the blossoms' gentle fragrances to envelop her. A soft breeze whispered through the petals, their delicate movements dancing harmoniously with the morning light. As Maya gazed upon this unexpected gift of nature's artistry, she felt an ineffable connection to her surroundings, embodying life's surprising ability to bestow unanticipated wonders. This small miracle sparked creativity within her, inspiring new dreams and ambitions gently nurtured by the garden's mystical allure. Her heart was filled with gratitude for this serendipitous reminder of beauty flourishing against life's uncertain,",long,medium,mixed,3rd,past
everyday_scenarios,narrative,conversational,Graduate,The Coffee Shop Connection,"In the midst of a bustling city, nestled among towering buildings, there was a quaint little coffee shop named Brew Haven, where strangers often found themselves becoming fast friends. One particularly chilly afternoon, Sam entered, seeking refuge from the biting winds. The shop’s cozy warmth enveloped him, with the fragrance of fresh beans weaving a comfortable tapestry. He ordered his usual, settling into a cushioned seat by the window, watching the world blur by with a cup of comfort in hand. Shortly after, a soft voice interrupted his thoughts. Lisa introduced herself, having noticed the book titled ""Journeys Unwritten"" resting atop Sam’s table, an unexpected shared interest sparking an engaging conversation. As the evening unfolded, talk of stories and dreams intertwined, their laughter blending into the shop’s resonance. What began as two individuals seeking solace in caffeine turned into a newfound friendship, celebrated over shared sips and spontaneous laughter amidst the backdrop of Brew Haven’s inviting ambiance. This simple encounter weaved a tapestry of connection, warmed",long,medium,mixed,3rd,past
everyday_scenarios,narrative,conversational,Graduate,The Park Bench Encounter,"One bright autumn afternoon, beneath a canopy of amber and gold, Sarah sat on her favorite park bench, nestled amidst the cascading rustle of leaves. The air carried subtle whispers from the gentle breeze playing through the branches, as the sun cast soft patterns upon the ground. She was lost in thought, pondering the complexities of life’s unpredictable journey. Her quiet contemplation was unexpectedly shared when an elderly man shuffled by, offering her a warm smile before taking a seat beside her. His name was Mr. Ellis, he revealed in a gentle tone, his eyes twinkling with stories yet untold. What ensued was a delightful exchange of tales spanning generations, as time bridged their years with empathetic understanding. Sarah listened intently as he recounted adventures woven with wisdom, his laughter resonating like a melody cherished by time. Their unexpected conversation transformed an ordinary moment into a cherished memory, fostering a bridge of connection stemming from their shared presence on that simple park bench, embraced by nature’s gentle symphony.",long,medium,mixed,3rd,past
everyday_scenarios,narrative,conversational,Graduate,The Quiet Library,"Nestled within the heart of a bustling city, there exists a library bathed in quietude, a sanctuary among chaos where thoughts found tranquility. The room, lined with shelves of old tomes, whispered stories in the language of time, inviting patrons into universes vast and varied. Among the seekers of silent companionship sat Jack, a man with an insatiable curiosity, hidden beneath a shadow of self-reflection. Here, with words donned in ink, he ventured beyond himself into narratives uncharted, the cracking of worn pages an accompaniment to his solitary journey. Around him, scattered readers found refuge in similar quests, their shared silence a comforting presence. Jack, though immersed in fictional worlds, remained tethered to reality through the collective hum of human experience shared by fellow wanderers. The library, a vessel for discovery and understanding, offered him passages to explore beyond the confines of ordinary life. In this space, he cherished the rare treasure of silent connections with kindred spirits seeking solace among the pages.",long,medium,concrete,3rd,present
everyday_scenarios,narrative,conversational,Graduate,The Gentle Storm,"On a nondescript weekday evening, as clouds gathered in a symphony of grays, the city awaited its date with a gentle storm. Each raindrop, like a silver bead from a celestial necklace, began to fall with measured grace, caressing rooftops and cobblestones below. Amelia, from her apartment window, observed the spectacle, sipping tea brewed with the warmth of familiarity. The storm, with its rhythmic whisper, stirred thoughts within her normally cluttered mind, ushering in clarity and calm. The streets, once alive with the hurried steps of commuters, transformed into serene boulevards of reflection, where umbrellas bloomed like colorful petals against the gray canvas. For Amelia, the rain was more than water from the heavens; it was a cleansing ritual, washing away the debris of mundane worries. In the heart of the storm, she found moments to pause and breathe, captured in the gentle flow of time and rain, wrapped within the delicate dance of nature’s embrace around her soul and the world.",long,medium,concrete,3rd,past
everyday_scenarios,expository,conversational,Grade8,The World of Online Gaming,"Online gaming connects players all around the globe, creating exciting virtual adventures. In these games, you can become a daring hero, explore mysterious lands, and solve challenging puzzles. Players often join teams to tackle quests and defeat powerful villains. Through online communities, gamers chat, share tips, and make friends, sometimes turning these connections into real-life relationships. While online gaming can be thrilling and helps improve problem-solving skills, it’s essential to balance playtime with other activities. Parents and kids should communicate about game choices and the time spent playing. With mindful play, online gaming can be fun and foster teamwork and creativity.",short,low,concrete,3rd,present
everyday_scenarios,expository,conversational,Grade8,The Magic of Baking Homemade Cookies,"Baking homemade cookies is a delightful way to spread joy and create comforting aromas at home. Start by gathering your ingredients: flour, sugar, eggs, butter, and the flavorings you love, like chocolate chips or vanilla. Mixing these ingredients can feel like a magical process, where simple items transform into doughy goodness. Slide the tray into the preheated oven and wait as fragrant scents fill your kitchen. Watch the dough puff up, turning golden brown, a sign that your cookies are ready. Enjoy them fresh from the oven with a glass of milk or share with friends. Baking cookies is not just cooking; it's an experience filled with warmth and happiness, instantly turning your house into a cozy haven.",mixed,low,concrete,3rd,present
everyday_scenarios,expository,conversational,Grade8,The Fun of Building Sandcastles,"Building sandcastles at the beach is an imaginative activity where the sand becomes a canvas for creativity. Start with wet sand, which is easier to mold. Dig a hole and pile up the sand, packing it down firmly to create a foundation. Use buckets and cups to shape towers, carving windows and doors with small tools or your fingers. Decorate using shells and pebbles to add flair to your castle. Working together with family or friends can turn this enjoyable pastime into a collaborative adventure. Watching the waves gently shape your creation adds to the fun, making each sandcastle a unique masterpiece.",mixed,none,concrete,3rd,present
everyday_scenarios,expository,conversational,Grade8,The Excitement of Flying Kites,"Flying kites is a fun activity that brings joy to both kids and adults. On a breezy day, find an open space, and let your colorful kite soar into the sky. As the wind catches the kite, it dances and twirls, adding life to the air. Use the string to control its movements, developing skills and focus while playing. Feeling the pull of the wind and the excitement of seeing your kite glide offer simple pleasures. Flying kites teaches patience and perseverance. Whether it’s a solo adventure or shared with friends, kite flying brings happiness and a sense of freedom, connecting us with nature and the elements.",short,low,concrete,3rd,present
everyday_scenarios,expository,conversational,Grade8,The Creativity of Drawing and Doodling,"Drawing and doodling are creative activities that stimulate imagination and relax the mind. With a pencil or marker in hand, anyone can create images, whether detailed or abstract. Letting lines flow naturally encourages spontaneous artistic expression, where perfection takes a back seat to fun. Doodling fills time creatively, turning idle moments into opportunities for art. It helps improve hand-eye coordination and fosters concentration. Over time, doodlers often find their unique styles, cherishing the creativity that spills onto their pages. Whether on a scrap of paper during a quiet moment or a sketchbook at home, drawing is a personal and fulfilling way to explore and communicate new ideas.",mixed,low,concrete,3rd,present
everyday_scenarios,expository,conversational,Grade8,The Adventure of Camping Outdoors,"Camping outdoors offers an exciting escape into nature, filled with adventures and relaxation. Setting up a tent in a forest or by a lake lets campers connect with the environment. Gathering around a warm campfire, they share stories and roast marshmallows under starlit skies. Hiking through trails reveals local wildlife and captivating landscapes, teaching campers about nature’s wonders. Sleeping in a sleeping bag surrounded by the sounds of the night can be both thrilling and calming. Camping encourages teamwork and self-reliance, making it a great learning experience. This adventure in the outdoors promises unforgettable memories and a chance to embrace the beauty of the wild.",short,low,concrete,3rd,present
everyday_scenarios,process_explanation,playful,Grade12,The Art of Wrapping Gifts,"Wrapping gifts can be as fun as giving them! Start with a colorful paper of your choice, ensuring there's enough to cover the entire gift. Place the gift upside-down on the unprinted side of the paper. Fold each side neatly and secure it with tape. The corners might be tricky, but with a few folds and more tape, you'll shape the paper into crisp edges. Add a ribbon or bow for a splash of flourish. Voilà, your gift looks fabulous and ready to impress! Creating an attractive package adds excitement to gift-giving. Remember, it's the thought and effort that spark joy more than perfection. Embrace the creativity and let your imagination twirl like a bow!",short,low,concrete,1st,present
everyday_scenarios,process_explanation,playful,Grade12,Mastering the Paper Airplane,"Building a paper airplane is a delightful childhood craft that never loses its charm. First, pick a standard sheet of paper, and fold it in half lengthwise, creating a crease as sharp as a bird's beak. Open it and fold the top corners to form a triangular point. Fold along the center again, and bend the wings down diagonally from the top edge. Pinch the cockpit and wings into aerodynamic shape, visualizing it soaring gracefully. Once ready, hold the plane delicately and launch it with a gentle flick of your wrist. Watch as your creation dances through the sky, defying gravity, weaving through life's invisible currents with glee. Experiment with different designs to find the champion of flight!",mixed,medium,concrete,1st,present
everyday_scenarios,process_explanation,playful,Grade12,Crafting the Perfect Cupcake,"Crafting the perfect cupcake can become a sweet adventure of creativity and delight. Begin by preheating the oven to a welcoming temperature, warming the air with sweet anticipation. Gather your ingredients—flour, sugar, eggs, butter, vanilla—and mix them into a velvety batter. Line your baking tray with colorful paper cups and fill each one with a tantalizing scoop of the mixture, watching it settle with glossy promise. As they bake, a fragrant symphony wafts through the kitchen, tickling taste buds and stirring scrumptious dreams. Once they've been baked to perfection, adorn each cupcake with a swirl of icing, tempting swirls of creamy delight waiting to be savored. Top with sprinkles for added whimsy. Each cupcake is a masterpiece of joy, eager to bring smiles and shared moments of indulgence.",long,medium,concrete,1st,present
everyday_scenarios,process_explanation,playful,Grade12,Painting Rocks,"Painting rocks transforms simple pebbles and stones into vibrant works of art, blending creativity with the natural world. Begin by selecting a few smooth stones that speak to you, inviting the brush's caress. Wash them carefully to remove dust, imagining the designs each will bear. Set up paints and brushes in a delightful array of colors, each hue adding potential and wonder to your palette. As you glide paint across stones, magical worlds unfold, be they whimsical patterns or cheerful faces. Each stroke can conjure stories upon their hardened surfaces, turning them into unique treasures ready to embellish gardens or sit as conversation pieces on shelves. Share these colorful creations or keep them as mementos of nature's artistry mingling with human touch.",long,medium,mixed,1st,present
everyday_scenarios,process_explanation,playful,Grade12,Creating a Home Garden,"Creating a home garden invites nature’s dance of colors and aromas into personal spaces. Start by choosing plants that resonate with your spirit, bringing joy and vibrancy to your days. Prepare the soil like a nurturing blanket, enriching it with nutrients to foster growth. Place your chosen seedlings into their new homes, arranging them thoughtfully to create an appealing variety. Water regularly, bathing them in life's liquid embrace, and watch over them with tender care. Add whimsical decorations—perhaps a garden gnome or twinkling lights—to infuse charm and comedy into the landscape. Relish in the rhythm of plant growth, nurturing both body and soul as nature's colorful symphony unfolds in your earthly sanctuary.",short,medium,concrete,1st,present
everyday_scenarios,persuasive,technical,Graduate,The Role of Technology in Education,"The rapid advancement of technology has fundamentally transformed educational methodologies, providing a robust platform for enhancing learning environments. Digital tools facilitate tailoring educational content to meet diverse learning needs, thereby promoting inclusivity and personalization. Virtual classrooms extend access to quality education beyond geographical barriers, fostering global knowledge exchange. Implementing advanced data analytics enables educators to track student progress in real-time, offering insight that informs teaching strategies for improved outcomes. Moreover, the integration of interactive simulations and immersive technologies, such as virtual reality, cultivates experiential learning, engaging students more effectively than traditional methods. Thus, embracing technology in education is imperative for fostering innovative, flexible, and responsive learning ecosystems.",long,none,abstract,3rd,present
everyday_scenarios,persuasive,technical,Graduate,The Importance of Renewable Energy,"Transitioning to renewable energy sources is crucial in addressing global environmental sustainability challenges and mitigating climate change impacts. Renewable energy harnesses natural resources such as solar, wind, and hydro, offering a sustainable alternative to fossil fuels. These technologies reduce greenhouse gas emissions, thereby contributing positively to environmental health and decreasing pollution levels. As advancements in technology lower costs, renewable energy becomes more accessible, significantly influencing energy policies and frameworks. Economic benefits arise from job creation within the renewable sector, promoting economic resilience. Therefore, prioritizing renewable energy investment is essential for a sustainable future, ensuring environmental integrity, energy security, and socio-economic well-being globally.",long,none,abstract,3rd,present
everyday_scenarios,persuasive,technical,Graduate,Advancing Public Health Through Telemedicine,"Telemedicine represents a transformative approach in advancing public health accessibility, leveraging technology to bridge the gap between patients and healthcare providers. Contemporary telehealth platforms facilitate real-time consultations, diagnostics, and continuous monitoring, thereby enhancing patient engagement and satisfaction. By mitigating geographical and logistical barriers, telemedicine ensures healthcare inclusivity, especially within remote or underserved regions. Furthermore, integrating artificial intelligence with telemedicine platforms enhances diagnostic accuracy, offering personalized treatment pathways. Amidst a global pandemic, the necessity for scalable telehealth solutions emerged, illustrating its pivotal role in sustaining healthcare delivery. Investing in telemedicine infrastructure is imperative for strengthening healthcare systems and promoting equitable access to quality medical services worldwide.",mixed,none,abstract,3rd,present
