domain,mode,tone,reading_level,title,paragraph,style.sentence_length,style.figurative_language,style.concreteness,style.viewpoint,style.temporal_focus
humanities,persuasive,formal,Graduate,Advocating for Digital Humanities,"Digital humanities represents the vanguard of interdisciplinary research, combining computational methods with traditional humanistic inquiry. Advocating for its growth is crucial, as it fosters innovative approaches to studying historical, linguistic, and cultural phenomena. By leveraging digital tools, researchers can process vast datasets, visualize complex relationships, and uncover insights previously obscured within traditional methodologies. This field democratizes access to knowledge by facilitating online archives and scholarly collaboration across global networks. Support for digital humanities epitomizes a commitment to intellectual evolution, merging empirical rigor with creative exploration. Future investment ensures the continued development of this dynamic discipline, enhancing both academic research and public engagement with cultural heritage.",long,none,abstract,3rd,future
humanities,narrative,reflective,Undergraduate,The Artist's First Exhibition,"Stepping into the gallery, I felt a mix of exhilaration and trepidation. My heart fluttered as I watched visitors engage with my paintings, their expressions a silent dialogue between artist and audience. Each canvas held whispers of my journey—brushstrokes narrating tales of solitude, vibrant hues dancing with dreams yet realized. The space brimmed with murmured discussions, my work sparking connections among strangers. As evening light spilled through the gallery windows, turning everything golden, I wandered from piece to piece, each a testament to perseverance and passion. The evening felt like an awakening, where creative visions found their place outside the confines of my studio walls, marking the beginning of new stories waiting to unfold.",mixed,high,mixed,1st,past
humanities,expository,technical,Grade12,Evolution of Typography,"Typography has experienced significant evolution, adapting to technological advancements and societal needs. Originating with movable type in the 15th century, typography revolutionized communication; Gutenberg's press enabled mass publication of texts. As literacy spread, typographical innovations flourished, evolving from simple serifs to complexly designed typefaces. The 20th century saw digital typesetting emerge, introducing versatility in design and application. Modern typography encompasses both functional and aesthetic considerations, balancing readability with creative expression. This ongoing evolution reflects typography’s dual role as both an art form and a practical tool in shaping written communication.",short,low,mixed,3rd,past
humanities,descriptive,plain,Grade12,A Day at the Art Gallery,"A day at the art gallery is an exploration of colors and shapes that invites personal reflection. As you step inside, rooms unfold like chapters in a book, each exhibit a fresh page of creativity. Soft lighting highlights paintings and sculptures, encouraging contemplation. Walking through the galleries, your footsteps quiet on the hardwood floor, you encounter landscapes that stretch to distant horizons and portraits that gaze back with knowing eyes. The atmosphere hums lightly with whispered admiration. Each artwork invites you into its world, offering beauty and meaning. As you leave, the gallery’s embrace lingers, sparking thoughts that resurface like strokes on a canvas.",mixed,medium,concrete,2nd,present
humanities,process_explanation,reflective,Undergraduate,Translating Ancient Texts,"Translating ancient texts is an endeavor that fuses linguistic acumen with cultural sensitivity, demanding both precision and imagination. Anticipating future translations involves preparing to navigate archaic dialects and deciphering complex syntactical structures, while retaining the original text's nuance and intent. It requires a deep understanding of historical contexts, as these inform language usage and idiomatic expression. Advances in machine learning and AI may offer invaluable assistance, yet the human translator’s insight remains indispensable. Through this intricate process, each preserved narrative becomes a bridge to our shared past, illuminating long-held human virtues and vices, facilitating a deeper comprehension of cultural evolutions and interconnected histories.",long,medium,mixed,3rd,future
humanities,persuasive,conversational,Grade8,Try Out a Musical Instrument,"Playing a musical instrument is like embarking on a fantastic adventure. Imagine the joy of strumming a guitar or tapping out a rhythm on the drums. It’s not just about making music; it’s about discovering new sounds and creating your own songs. Learning an instrument helps improve concentration and boosts creativity. You might even make new friends in a band or orchestra. Music can express emotions when words fall short, and playing your favorite tunes is a joy. So, pick up an instrument and let your musical journey begin! The world of melody and harmony is just waiting for you to dive in and explore.",short,medium,concrete,1st,present
humanities,narrative,reflective,Graduate,The Solitary Library Visit,"One winter’s afternoon, enveloped by a gentle snowfall that rendered the city in muted shades, I embarked upon a solitary visit to the public library. The air inside was laden with the scent of aged paper, an olfactory tapestry woven with tales and theories. I roamed the aisles aimlessly, fingertips grazing the spines of myriad books, each a silent testament to unspoken worlds. Settling into a sun-dappled corner, I unearthed a forgotten classic, its pages yellowed and brittle. As hours passed unheeded, I found myself gradually entwined with the narrative, each word a thread binding me to past luminaries. On that day, the library became an expansive refuge, a vessel of continuity within which knowledge and tranquility flowed ceaselessly, providing solace and insight amidst the clamor of modernity.",long,medium,mixed,1st,past
humanities,expository,playful,Graduate,The Charm of Vintage Typography,"Vintage typography, with its whimsical serifs and flourished ligatures, holds an undeniable allure for designers and nostalgic aficionados. It's a delightful journey through the evolution of visual storytelling, revealing how styles from Art Deco to Mid-Century Modern captured societal zeitgeists, each font a snapshot of its era. These typographic treasures convert letters to characters—Futura’s geometric precision contrasting with Bodoni’s elegant strictness. In contemporary design, resurrecting past fonts adds an enchanting layer of character, each curve and line intertwining old-world charm with modern adaptability. In essence, vintage typography serves as an artistic time machine, enriching today's narratives by channeling yesteryear’s stylistic ethos.",long,high,concrete,3rd,present
humanities,descriptive,conversational,Grade8,A School Art Fair,"The school art fair buzzes with excitement as you step into the gymnasium. Paintings and sculptures, brimming with creativity, fill the space, each piece telling its own story. Bright colors swirl in abstract forms and detailed landscapes sit still, waiting for your gaze. Students, proudly standing beside their works, chat eagerly with visitors. The scent of fresh paint mingles with popcorn popping at a nearby stand. You wander from booth to booth, feeling inspiration dance around you. Everywhere you look, there's something new to discover and admire. The fair gives you a taste of budding talent and endless imagination, leaving you inspired and curious to create.",short,medium,concrete,2nd,present
humanities,process_explanation,formal,Graduate,Developing an Educational Curriculum,"Developing an educational curriculum entails a comprehensive strategy, aligning pedagogical objectives with learning outcomes across varied disciplines. Future curriculum design prioritizes flexibility and adaptability, addressing the fast-paced evolution of societal demands and technological advancements. It begins with establishing core competencies that learners must attain, integrating interdisciplinary perspectives to foster holistic understanding. Design nuances must consider diverse learning styles, ensuring accessibility and inclusivity. By implementing iterative assessments, curriculum planners gauge efficacy, making data-driven refinements. This continuous feedback loop guarantees alignment with educational standards while promoting critical thinking and creativity. As education evolves, curriculum development remains a dynamic pursuit, perpetually aligning with cultural and intellectual progress.",long,none,abstract,3rd,future
humanities,persuasive,technical,Undergraduate,Support Open Access Publishing,"Supporting open access publishing is essential for democratizing knowledge and fostering innovation. Immediate and unrestricted access to research accelerates academic and scientific advancement, circumventing traditional barriers posed by costly journal subscriptions. By advocating for open access, I contribute to a culture of transparency and collaboration, enabling researchers globally to build upon existing work without hindrance. This model empowers low-resource institutions and independent scholars, leveling the scholarly landscape. Embracing open access publishing not only enhances global information dissemination but also promotes the efficient allocation of resources, thereby strengthening the cumulative intellectual contributions that drive technological and cultural evolution.",mixed,low,abstract,1st,present
humanities,narrative,playful,Grade12,The Puppet Show,"Once, under the warm embrace of summer, children gathered eagerly in a small town square for the annual puppet show. As the curtain lifted, colorful characters sprang to life, their antics eliciting squeals of joy and laughter. Marionettes waltzed and clowned, each movement a precise dance of string and hand. The sky, a brilliant azure backdrop, seemed to mirror their exuberance. Beneath the makeshift wooden stage, the puppet master's eyes twinkled with mischief, his storytelling weaving enchantment. By evening's end, the little audience reluctantly departed, each child cradled by dreams of puppets cavorting on moonlit stages, sparking imagination with strings and tales.",short,high,concrete,3rd,past
humanities,expository,reflective,Undergraduate,The Impact of Modern Art Movements,"The impact of modern art movements reverberates profoundly within contemporary culture, exemplifying a relentless quest to redefine artistic boundaries. From Impressionism's bold rejection of traditional techniques to Surrealism's provocative exploration of the subconscious, modern art challenges perceptual conventions, fostering individual expression over established norms. Future art movements will likely continue this trajectory, blending technology with artistic practice, fostering novel forms of interaction and comprehension. This ever-evolving dialogue mirrors societal shifts, encouraging inclusivity and diversity. By examining modern art's transformative influence, society gains insight into broader cultural dynamics, understanding how art both reflects and shapes collective human experience's ongoing narrative.",long,medium,abstract,3rd,future
humanities,descriptive,playful,Grade8,The Local Fair,"At the local fair, vibrant colors and cheerful sounds fill the air. Brightly painted carousels spin, their music chiming a joyful tune. Stalls burst with playful games and delicious treats, enticing visitors with sweet aromas of candy apples and popcorn. The Ferris wheel rises high, offering a sweeping view of laughter below. Children chase bubbles, their giggles shimmering like soap in sunlight. Amidst this lively scene, clowns juggle brightly colored balls, spreading smiles wherever they go. Each moment holds a bit of magic, feeling like a whimsical dance of happiness and fun. The fair's electric atmosphere makes adventures float like kites on a breezy day.",mixed,high,concrete,3rd,present
humanities,process_explanation,conversational,Undergraduate,Organizing a Film Festival,"Organizing a film festival is like orchestrating a symphony of stories. Begin by deciding on a theme that resonates with the films you choose to showcase. Select a venue, ensuring it can accommodate the expected audience size comfortably. Coordinate with filmmakers and distributors to bring diverse films to your screens. Promote the festival through social media and community channels to attract cinephiles. Plan Q&A sessions with directors, providing a platform for engaging discussions. Consider programming workshops to enrich the festival experience. As the festival unfolds, monitor logistics to ensure a seamless flow of events. Celebrate as each film brings its unique voice to the screen, contributing to the cultural dialogue.",short,medium,mixed,2nd,future
humanities,persuasive,reflective,Graduate,Promoting Cultural Literacy,"Promoting cultural literacy is vital in fostering a society rooted in understanding and empathy. As I consider the intricate tapestry of global narratives, it becomes evident that cultural literacy enriches dialogue by equipping individuals with the knowledge to navigate diverse perspectives. By embracing this cause, the future promises environments where cultural exchange transcends mere tolerance to become a profound appreciation of humanity's shared heritage. This extends beyond experiencing different traditions; it involves comprehending the influences shaping these narratives. Supporting cultural literacy initiatives empowers communities to develop open-mindedness and mutual respect, nurturing innovation while celebrating the intricate dance of cultural confluences that define our collective journey.",long,medium,abstract,1st,future
humanities,narrative,conversational,Grade12,The Hidden Library,"As a child, I discovered a hidden library beneath the creaky stairs of my grandparents' house. It was a small alcove, LED by a beam of golden afternoon light that seemed to beckon adventurers. Every afternoon, I'd slip away to read dusty tomes filled with tales of courage and mystery. The air smelled of age and imagination, each breath a promise of adventure. Sometimes, a stray spider would weave its silk alongside my own web of thoughts. Those books, with their leather covers and whispered stories, cradled me through sunlit afternoons, inspiring dreams woven from words and leading me on quiet journeys that stretched far beyond the page.",mixed,medium,mixed,1st,past
humanities,expository,formal,Graduate,The Foundation of Literary Criticism,"The foundation of literary criticism rests upon a bedrock of theoretical approaches seeking to elucidate the multifaceted layers encapsulated within texts. Formalism, with its emphasis on textual structure and literary devices, delves into the intrinsic elements present within the work itself. Structuralism, postulating the universality of underlying structures, interprets texts through patterns and systems. Additionally, Marxist criticism scrutinizes class dynamics, emphasizing socioeconomic influences shaping narrative frameworks. Psychoanalytic theory unlocks the depths of character motivations, informed by subconscious processes. Each school of thought offers distinct lenses, converging upon a shared goal: providing insight into the author's rhetorical intent and fostering a richer understanding of the surrounding cultural and historical milieus. These methodologies form the cornerstone of critical discourse, guiding scholarly exploration and interpretation.",long,low,abstract,3rd,past
humanities,descriptive,technical,Undergraduate,Inside the Conservatory,"Inside the conservatory, a world of glass and greenery unfolds. Exotic plants thrive beneath the glazed dome, casting intricate shadows. Temperature and humidity are carefully controlled, simulating diverse ecosystems with precision. Walkways meander through lush foliage, visitors exploring this verdant sanctuary. Water features, gently babbling, add tranquility to the space. Sunlight filters through the panes, nurturing life in its spectrum. Here, nature is curated and cultivated, a scientific endeavor merging with artistic display. Each plant, identified with meticulous care, invites appreciation of biological diversity and ecological importance, framed within this serene architectural marvel.",short,low,concrete,3rd,present
humanities,process_explanation,formal,Grade12,Studying Linguistic Anthropology,"Studying linguistic anthropology involves examining the intricate relationship between language and culture. Linguistic anthropologists analyze how language influences communication patterns, social identity, and cultural beliefs. They explore the variations in language use and the socio-cultural contexts that shape linguistic practices. Fieldwork often comprises immersive observation within communities, allowing researchers to document language evolution and transmission across generations. Through comparative studies, linguistic anthropology reveals both the uniqueness and commonality of human language, providing insights into the cognitive and social aspects of verbal expression. This discipline bridges linguistics and cultural anthropology, emphasizing language's foundational role in constructing reality and maintaining cultural continuity.",mixed,low,abstract,3rd,present
humanities,persuasive,technical,Graduate,The Need for Sustainable Urban Design,"Sustainable urban design is imperative for creating resilient and livable cities. Future urban planning must integrate environmental consciousness with socio-economic viability. It employs green technologies and principles like energy efficiency, low-impact transportation, and resource conservation. Such designs promote healthier communities by enhancing urban greenery and public spaces. Economic benefits arise from reduced energy costs and improved public health outcomes. Social inclusion is strengthened through equitable access to amenities. Policymakers play a critical role in facilitating sustainable practices, urging collaborative approaches between stakeholders. Investing in sustainable urban design represents a commitment to nurturing ecosystems and fostering urban harmony.",short,none,abstract,3rd,future
social_sciences,narrative,playful,Grade8,The Idea Swap,"Every Friday afternoon, our history class transforms into a lively arena where ideas are exchanged like colorful marbles. It's not just conversations; it's like an imaginative ping-pong game. Today, we’re discussing ancient civilizations, and I toss an idea about Egyptian hieroglyphics. Jake, quick with his speech, counters with tales of Viking voyages, adding a dash of mystery. The sun streams through the windows, casting playful shadows on the desks. These discussions feel like a dance, as we sway between facts and fiction, laughed at by sunlight skimming across the classroom. The room bursts with energy, ideas, and laughter, casting a spell of curiosity over us all.",mixed,medium,concrete,1st,present
social_sciences,narrative,reflective,Grade12,The Unseen Influence,"Tom had always wondered about the subtle forces shaping his neighborhood. Strolling down Oak Avenue, he paused at the corner store, a place bustling with stories untold. As autumn leaves spiraled down like tiny messengers of time, he recalled the elderly shopkeeper's tales about the community back when the streets hummed with a different vibrancy. It was a time when gatherings were more than mere pleasantries; they were vivid threads weaving the tapestry of society. Reflecting upon how each choice, like the selection of a book from the old shelf there, stitched into the larger narrative of the town, Tom understood that history lurked silently beneath the surface, lending unseen strength to the present.",long,medium,mixed,3rd,past
social_sciences,narrative,conversational,Undergraduate,A Day at the Museum,"You know, one day I'll finally go to that anthropology museum. It's not just about seeing old pottery or bones, but more about feeling connected to threads of stories that humans have woven across eons. Imagine peering at an artifact and sensing the hands that molded it long ago. I dream about the conversations I'll stumble upon between visitors, their whispers filling the air like notes in a forgotten song. Remnants of civilizations just begging to tell their tales. It's not only about dry facts but also about shared glances, a mutual understanding that, despite time, not much separates us from those who came before.",mixed,low,mixed,1st,future
social_sciences,narrative,formal,Graduate,The Echo of Tradition,"In the serene village nestled among whispering hills, cultural traditions continue to serve as the lifeblood, a harmonious rhythm orchestrating daily life. Here, the cadence of ancient rituals persists, weaving consistency into the fabric of modern existence. Anthropological perspectives contend that such practices provide collective identity and social cohesion, acting as a repository of wisdom. Citizens partake in these rituals with an intrinsic understanding that they carry forward not mere repetition, but an echo of lessons transmitted through generations. Such ceremonies are suffused not merely with nostalgia but with a reflective awareness of their evolving significance within the community's social milieu. In this intersection, the past converses quietly yet profoundly with the present, ensuring continuity within the realm of historical consciousness.",long,low,abstract,3rd,present
social_sciences,expository,plain,Grade8,Understanding Communities,"A community is a group of people living in the same area. They might share common interests or goals. Many communities come together to solve problems or celebrate special events. People in a community often work together to keep it safe and clean. Schools, parks, and local businesses are important parts of a community. They help people connect and support each other. Communities can be small, like a neighborhood, or large, like a town. Each has its own unique qualities and spirit. The strength of a community depends on how well its members cooperate and care for each other. These bonds create a sense of belonging and security.",short,none,concrete,3rd,present
social_sciences,expository,formal,Grade12,The Role of Socio-Economic Status,"Socio-economic status, often abbreviated as SES, historically played a pivotal role in shaping access to resources and opportunities. It encompassed educational attainment, income levels, and occupational prestige. In many societies, SES influenced the distribution of wealth and the ability to pursue higher education. The implications of SES were observed in varying aspects of life, including healthcare access, housing quality, and social mobility. Understanding its intricacies provides insight into the broader socio-cultural framework of a society. Historical analyses reveal that shifts in SES were frequently linked to broader economic and policy changes, further affecting demographic trends. As an important sociological variable, SES continues to inform discussions on growth and inequality.",mixed,low,mixed,3rd,past
social_sciences,expository,technical,Undergraduate,Social Network Theory,"Social network theory, an integral aspect of contemporary sociological inquiry, examines the structures formed by individuals, organizations, or entire communities. It explores how these networks influence behavior, resource distribution, and information flow within the societal context. This theoretical framework considers nodes as the endpoints representing individuals or entities and ties as the relationships connecting them. Analytical tools such as network analysis are employed to quantitatively assess connectivity and centrality within these structures. These methods provide insights into social capital dynamics, elucidating how power and influence traverse the web of interactions. Proponents assert that understanding the intricacies of social networks contributes to comprehending larger social phenomena and complexities inherent in social systems.",long,none,mixed,3rd,present
social_sciences,expository,plain,Graduate,Historical Patterns of Migration,"Historically, human migration has been driven by a multitude of factors including economic necessity, environmental changes, and geopolitical dynamics. These movements resulted in the settlement of diverse cultural groups and the consequent intercultural exchanges that have significantly shaped societies. Researchers examining historical migration patterns often utilize demographic data and archival records to trace the movements of populations across continents and through eras. This scholarship highlights the impact of such migrations on indigenous cultures, local economies, and societal structures. By understanding these patterns, scholars strive to elucidate broader socio-political narratives, providing context to the transformational processes that have influenced historical trajectories. Such insights are critical for comprehending the socio-political fabric of contemporary societies.",long,none,abstract,3rd,past
