domain,mode,tone,reading_level,title,paragraph,style.sentence_length,style.figurative_language,style.concreteness,style.viewpoint,style.temporal_focus
engineering,expository,playful,Undergraduate,Introducing Drone Technologies,"Drones, once fantasy, are now buzzing realities in various fields! Thanks to advances in engineering, these flying machines soar above, capturing photographs, delivering packages, and even performing search and rescue missions. You, too, can explore drone technology, which involves a fascinating blend of aerodynamics, electronics, and software. Tiny sensors and cameras guide them, while rotors keep them aloft. Imagine designing a drone, customizing its features and watching it take flight over rolling hills or bustling cities. It’s an exciting time to dive into this world where creativity meets technology, calling curious minds to innovate and redefine the skies. Join the drone revolution, and elevate your engineering dreams!",mixed,medium,mixed,2nd,present
engineering,descriptive,conversational,Grade8,Inside the Windmill,"Step inside the windmill, where large wooden beams tower above. You hear the creaking sound as the wind pushes the blades outside. Inside, gears grind steadily, transferring energy down into the mill's heart. The air smells of grain and history, mingling with sweat from hard-working hands. Sunlight peeks through cracks, casting playful shadows on the stone floor. Imagine running your fingers along the smooth timber, feeling the rhythm of a structure built long ago. It's a place where engineering and tradition meet, spinning tales of innovation. Picture it as a majestic giant, harnessing nature's breath to fuel human endeavors, day by day.",short,low,concrete,2nd,present
engineering,process_explanation,playful,Grade12,Creating a Virtual Reality World,"Creating a virtual reality (VR) world entails crafting digital dreams. Engineers start by designing lush landscapes using computer graphics software, sculpting mountains and rivers with virtual brushes. Code, like a magic spell, infuses these creations with interactivity, letting users wander through enchanted forests or bustling cities. Immerse yourself in this digital realm with VR headsets that transform imagination into reality. Controllers act as your hands, grabbing virtual stars or tools within arm’s reach. Debugging is an art, weaving solutions to technical glitches that might shatter the illusion. Finally, your VR world emerges, a pixelated paradise ready to explore, offering a sandbox for kinetic creativity and endless adventures.",short,high,mixed,3rd,present
engineering,persuasive,conversational,Graduate,Rethinking Urban Mobility,"Rethinking urban mobility, I advocate for integrated systems that harmonize personal convenience with ecological responsibility, providing solutions beyond conventional transport. Imagine future cities where autonomous pods glide silently along magnetized pathways, seamlessly interwoven with green energy networks. Encouraging collaborations across sectors, from urban planning to information technology, we can develop infrastructures mitigating congestion and pollution. By supporting innovations in networked mobility, enhancing mass transit accessibility, we pave paths towards sustainable urban environments. Let us set our sights on transforming how cities breathe and move, fostering synergies between advanced engineering practices and societal needs. Through bold visions and cooperative actions, we can sculpt vibrant future landscapes, an endeavor both achievable and imperative for thriving urban ecosystems.",long,medium,abstract,1st,future
engineering,narrative,plain,Undergraduate,Tagging Along on a Field Study,"I vividly remember tagging along on a field study, observing the installation of solar panels on rooftops. The morning air was brisk, the sun casting golden hues on the cityscape. We navigated ladders and scaffolding, assisting seasoned workers aligning panels to capture optimal sunlight. Conversations buzzed with technical jargon, yet an underlying excitement resonated among the team. After securing the last panel, a collective cheer marked the accomplishment. This hands-on experience etched into my memory the tangible impact of engineering solutions on daily life. It wasn’t just work; it was a harmonious dance of collaboration and technology, showcasing a commitment to sustainable innovation.",mixed,low,concrete,1st,past
engineering,expository,reflective,Undergraduate,Reflecting on Bridge Design Challenges,"Reflecting on the challenges of bridge design unveils a landscape of creativity bounded by logic and necessity. Engineers, tasked with merging aesthetics and functionality, confront variables like material constraints and environmental impact. Historical projects highlight these trials, where overcoming adversity often meant pioneering groundbreaking techniques and materials. Innovations such as suspension technology evolved from need, spawning entire architectural genres. The stories embedded within these designs speak of relentless pursuit, leveraging technological advancements to address the demands of societies increasingly dependent on rapid transit and connectivity. Through this reflective lens, one appreciates the continued importance of bridging disciplines—literally and figuratively—in advancing architectural feats and human ambition.",long,medium,mixed,3rd,past
engineering,descriptive,technical,Graduate,The Advanced Robotics Facility,"Within the advanced robotics facility, precision and innovation take physical form. Rows of robots, each designed for specific tasks, occupy spaces among disciplined engineers managing research and development protocols. The ambient hum of mechanical whispers mingles with conversations on optimization techniques and algorithmic improvements. High-resolution monitors relay real-time data, while automated guided vehicles transport components across the floor, ensuring a seamless supply chain in the prototype lab. Engineers, donning lab coats, interface with machines through intricate control systems, examining telemetry and calibrating responsive units. This environment encapsulates the marriage of technological prowess and intelligent design, a testament to the relentless pursuit of mechanized perfection and engineered excellence.",long,none,concrete,3rd,present
engineering,process_explanation,formal,Undergraduate,Assembling a Drone Kit,"To assemble a drone kit, first ensure you have all components: frame, motors, propellers, electronic speed controllers, and flight controller. Begin by attaching the motors to the frame, ensuring tight screws. Connect electronic speed controllers to the motors, soldering as necessary. Attach the propellers, checking for correct orientation and balance. Mount the flight controller centrally, securing it with provided hardware. Calibrate the controller using recommended software, setting up the remote control link. Perform a pre-flight check, verifying connections and battery charge. Confirm that signals are correctly received, and the stabilization system is functioning. Ready, the drone awaits its inaugural flight, prepared to explore the skies with precision and grace.",short,low,concrete,2nd,future
engineering,persuasive,technical,Graduate,Adopting Additive Manufacturing,"Adopting additive manufacturing, or 3D printing, within industrial sectors represents a paradigm shift towards enhanced production efficiencies and customizability. This technology allows for layer-by-layer construction, minimizing material waste associated with traditional subtractive methods. Industries recognize its potential for rapid prototyping, facilitating iterative design processes that accelerate innovation cycles. Treated layers using advanced materials offer bespoke solutions, fulfilling complex geometric requirements that conventional methods cannot achieve. Increasingly, additive manufacturing integrates seamlessly with digital supply chains, optimizing inventory management and enabling on-demand production. Embracing this technology signifies an evolutionary step towards sustainable manufacturing practices, redefining design potential and operational efficiencies on a global scale.",long,none,abstract,3rd,present
engineering,narrative,playful,Grade8,Adventures in Space Engineering Camp,"Picture a day at Space Engineering Camp, where you're building a rocket! With a pep in your step, you wander through stations filled with parts: metal sheets shine like stars, circuits sparkle, and coded screens flash equations. Around you, everyone buzzes with excitement and curiosity. You’re handed a toolkit, eager to assemble components under a mentor’s guidance. The rocket takes shape—a towering structure reaching for the skies. Soon, countdown begins, hearts quicken, and ignition! The rocket whooshes upward, spiraling into the blue abyss. Your eyes wide with awe, you realize it wasn’t just about building a rocket; it was a leap into dreams and wonders, an unforgettable blend of creativity, teamwork, and scientific exploration.",short,high,concrete,2nd,future
engineering,expository,formal,Undergraduate,Basics of Electrical Grid Operations,"The electrical grid constitutes a network of generating stations, transmission lines, and distribution systems, essential for electricity delivery. Power generation occurs at plants where various energy sources—fossil fuels, nuclear, and renewables—drive turbines to produce electricity. This electricity traverses high-voltage transmission lines, minimizing loss over vast distances. Substations reduce voltage before channeling it through distribution networks to homes and industries. Balancing supply and demand ensures grid stability, while automated systems manage real-time adjustments. Grid reliability hinges on maintenance, forecasting, and infrastructure resilience. Engineers continuously innovate to integrate renewable energy sources, addressing environmental concerns while enhancing grid efficiency and reliability for sustainable energy future.",mixed,none,abstract,3rd,present
engineering,descriptive,reflective,Graduate,A Visit to the Satellite Assembly Hall,"Upon visiting the satellite assembly hall, I was engulfed by a world shaped by precision and cosmic aspirations. Beneath meticulously controlled environments, the air crackled with innovation as components metamorphosed into celestial instruments. These satellites, birthed from both hands and minds, lay dispersed like slumbering titans on cradles of steel, awaiting the call of the stars. Technicians glided silently across the expanse, their hands conducting symphonies of circuits and panels with dexterous grace. Whispered discussions on cryogenics and orbital mechanics filled the segregated spaces. This hall, a temple of technological prowess, mirrored humanity’s insatiable quest to reach beyond, where the embrace of the infinite sky transcended earthly bounds. Inevitably, it painted a reminiscent picture of dreams materializing, leaving an indelible imprint of celestial progress, and a deeper connection to the universe.",long,high,abstract,1st,past
engineering,process_explanation,reflective,Undergraduate,Crafting a Smart Home System,"In crafting a smart home system, I embrace a world of possibilities where every appliance dialogues through technology. The journey begins with selecting compatible devices, contemplating not merely functionality but integration. Wiring the hub involves traversing a digital landscape, configuring connections to foster seamless communication. Through mobile applications, each function receives a narrative of control, from lighting preferences to security alerts. Subtle adjustments hone the system, aligning it with habits and desires until it resonates intimately within daily life. This endeavor, beyond assembly, is about forging a symbiosis between human habitation and innovation, an endeavor rewarding in its exploration of comfort, agency, and interconnected elegance. Thus, with each programmed command, I sculpt a domestic ecosystem that mirrors aspiration with reality, offering convenience alongside complexity and reflecting the enormous potential of intelligent design.",long,medium,mixed,1st,present
engineering,persuasive,plain,Graduate,Encouraging Sustainable Urban Design,"In fostering sustainable urban design, consider how integrating green spaces and efficient infrastructure can significantly enhance quality of life. Urban areas need to embrace innovative solutions like vertical gardens and eco-friendly transport systems to combat pollution and overcrowding. Implementing sustainable practices isn’t merely optional; it’s imperative for future resilience. Such designs can restore the delicate balance between urban expansion and environmental preservation. By investing in renewable energy systems and adaptive architecture, cities can reduce their carbon footprint. This approach doesn’t only benefit the environment but stimulates economic growth and community well-being. So, envision a future where cities are not only vibrant but also sustainable, embodying harmony between humanity and nature. It's critical for tomorrow’s societies to thrive.",mixed,low,abstract,2nd,future
engineering,narrative,technical,Graduate,Navigating Through Complex Algorithms,"Amidst a symposium of computational prowess, Alex grappled with complexities surmounted by algorithms governing artificial intelligence. The labyrinthine paths of neural networks unfolded like digital neural tapestries, crafting patterns deciphered through relentless cycles of iteration. Each algorithm, optimized meticulously, navigated voluminous data landscapes, their integrity fortified by mathematical precision and computational finesse. As Alex decoded sequences into tangible insights, a cornerstone of data-centered engineering emerged. This pursuit—blending probability, statistics, and logic—underlined the intricacies shaping tomorrow’s innovations. Thus, the mastery of algorithms was an art form, reflecting an understanding woven through logical structures, optimizing what was technically feasible, crafting a future graced by precise, intelligent systems.",mixed,none,abstract,3rd,present
engineering,expository,technical,Grade8,Basics of Aerodynamics,"Aerodynamics is all about how air moves around things like cars or planes. It helps engineers make designs that cut through air easily. Planes, for example, use wings shaped to glide smoothly, creating lift. Cars are designed to reduce air resistance, which helps them go faster and save fuel. When you stick your hand out of a moving car window and feel it wiggle, that’s aerodynamics in action. Engineers study these air flows using simulations and wind tunnels. Learning the basics of aerodynamics can help design better, faster, and safer machines, making travel and transport more efficient and exciting for everyone.",short,none,concrete,2nd,present
engineering,descriptive,plain,Grade12,A Day at the Design Studio,"In the design studio, materials are scattered around me—bright fabrics, glossy metals, and sleek plastics. I sit at my drawing table, surrounded by sketches of futuristic gadgets and furniture. The hum of computers fills the air as colleagues tweak digital models. Sunlight filters through large windows, casting patterns on the floor. I glance at blueprints pinned to corkboards, each line representing innovation. Nearby, a 3D printer clicks silently, bringing ideas to life layer by delicate layer. As I refine my designs, ideas intermingle, leading to unexpected solutions. Here, creativity and practicality coalesce, shaping the everyday objects of tomorrow. This studio is a realm of endless possibilities.",short,medium,concrete,1st,present
engineering,process_explanation,playful,Undergraduate,Molding a Technology Roadmap,"Charting a technology roadmap is a bit like planning a treasure hunt, except the prizes are innovations and breakthroughs! Start with identifying core objectives—these are your treasure markers. Map out the road with timelines and milestones that lead to tech gold. Keep an eye on industry trends, leveraging them like a compass pointing to opportunities. You’ll need to refine your processes and gather insights from data, steering the course with strategy. Along the way, celebrate small victories; each success is a nugget of accomplishment. Uncertainty might present hurdles, but adapt with agility. Ultimately, your roadmap is a voyage, highlighting the spirit of exploration where discovery awaits the curious and the daring.",mixed,medium,abstract,2nd,present
engineering,persuasive,reflective,Graduate,Pioneering Greener Aviation,"In an era focused on environmental stewardship, the aerospace industry faces a call to pioneer greener aviation technologies, a pursuit as complex as it is necessary. Developing sustainable fuels and innovative designs underscores the urgency for change as climate considerations demand a transition from conventional systems. Electrification of aircraft emerges as a promising frontier, bolstered by advancements in battery efficiency and materials science. Additionally, aerodynamic refinements and lightweight composite materials offer pathways to reduce energy consumption significantly. Industry leaders must collectively champion these initiatives, not purely from regulatory compliance but as a commitment to posterity. Such ventures not only embody technological progress but also reflect a deeper ethos of responsibility towards a shared planet, crafting a trajectory where human advancement aligns seamlessly with ecological respect.",long,medium,abstract,3rd,present
engineering,narrative,conversational,Undergraduate,Learning to Program,"I remember the first time I learned to program, a journey into a digital landscape of logic and creativity. Sitting at my computer, I explored the labyrinth of syntax, variables, and loops. Lines of code began to flow like sentences in a new language. Each function and command became a puzzle to solve, turning problems into interesting challenges. Guidance from online forums and patient mentors helped me navigate trials and errors. As I finally created my first working program, a sense of accomplishment filled the air! It wasn't just about the code; it was about realizing the potential of ideas transformed into reality through technology. This experience ignited a passion for engineering and innovation, marking the start of an exciting path ahead.",mixed,low,concrete,1st,past
engineering,expository,plain,Grade12,Renewable Energy Basics,"Renewable energy comes from natural sources like solar, wind, and water, replenishable within a human timeframe. These sources produce less pollution compared to fossil fuels and are vital for a sustainable future. Solar panels capture sunlight, converting it into electricity that powers homes and gadgets. Wind turbines use moving air to generate energy, commonly found in open spaces or offshore. Hydropower harnesses energy from flowing water, with dams often serving dual purposes of energy production and flood management. You can see these technologies integrating more with traditional systems, offering cleaner alternatives. Exploring renewable energy is essential for environmental preservation and energy security.",mixed,none,mixed,2nd,present
engineering,descriptive,playful,Graduate,The Experimental Energy Lab,"In the experimental energy lab, where the boundaries of science and innovation dance together, you find yourself traversing a kaleidoscope of possibilities. Here, coils looped like modern-day alchemical symbols hum softly with the symphony of quantum mechanics. Solar arrays bask under artificial suns, their photovoltaic dreams cradling the promise of sustainable futures. Technicians, clad in their safety gear, manipulate the levers of ingenuity, coaxing forth electricity from the ether. You wander through workstations, where digital numbers flutter across screens like futuristic butterflies, revealing data sets that tease tomorrow's breakthroughs. This vibrant interplay of technology and creativity envelops you, echoing with the timeless narrative of human curiosity and our relentless quest to harness the boundless energy of the universe. Surely, this lab stands as a testament to a greener world awaiting discovery, each experiment an ode to sustainable ingenuity.",long,high,abstract,2nd,present
engineering,process_explanation,technical,Graduate,Understanding Blockchain Architecture,"Blockchain architecture is a decentralized technology critical in ensuring data integrity and security. It consists of a series of blocks linked in a chronological chain, where each block contains a list of transactions. These transactions are verified by a consensus mechanism—like proof of work or proof of stake—before being added to the chain. Cryptographic hashes secure each block, safeguarding the data from unauthorized alterations. Smart contracts, self-executing contracts coded within the blockchain, facilitate transactions without intermediaries. Scalability, a significant attribute, is often enhanced through solutions like sharding and sidechains. This framework underpins applications across multiple domains, offering a transparent, trustworthy digital ledger system essential for modern decentralized applications.",mixed,none,abstract,3rd,present
engineering,persuasive,playful,Undergraduate,Embracing Quantum Computing,"Diving into the kaleidoscopic world of quantum computing feels like unlocking a treasure chest of infinite possibilities, a dimension where traditional barriers dissolve! Imagine harnessing qubits, analogous to Schrödinger’s famously ambivalent cat, to revolutionize problem-solving speeds, redefining computational landscapes and shattering classical limits. As an engineer, I advocate for embracing this qubit kingdom with enthusiasm, as quantum computing equips us to disentangle unsolvable problems and decode mysteries previously out of reach. Through superposition and entanglement, quantum systems evolve within inscrutable simplicities—dancing amidst probabilities to choreograph groundbreaking solutions. Venture into this enchanting universe with an open mind, embracing the advance of quantum realms, where imagination meets engineering and creativity blossoms into tangible breakthroughs that tickle the edges of reality itself!",long,high,abstract,1st,present
engineering,narrative,formal,Graduate,Developing Urban Infrastructure,"In a city where opportunities converged, development of urban infrastructure unfolded with meticulous planning and precision engineering. Architects and engineers examined blueprints beneath the glow of halogen lamps, weaving every sidewalk and conduit into the tapestry of growing metropolises. Streets stretched like arteries, shimmering with digital signals flowing through them, connecting neighborhoods in a seamless web. High-rise buildings emerged from dust-strewn landscapes, their facades reflecting a synthesis of modern design and timeless function. Community parks, nestled within urban jungles, cultivated greenery amidst concrete, forming sanctuaries of serenity and shared space. The synchronized symphony of construction fostered a new realm, balancing progress with preservation, and leaving a legacy of interconnected urbanity. Guided by principles of sustainability and innovation, the infrastructure not only shaped the skyline but nurtured the soul of a thriving urban expanse.",long,medium,concrete,3rd,past
engineering,expository,reflective,Undergraduate,The Importance of Ethical Engineering,"Reflect upon the significance of ethical engineering, where technological innovations intersect with moral considerations, shaping societies in transformative ways. Engineers hold the power to influence economies and environments profoundly, making the alignment of progress with ethical principles paramount. As an engineer, you engage with dilemmas involving resource allocation, privacy, and sustainability, requiring careful deliberation and responsibility. Advances in domains such as artificial intelligence and biotechnology necessitate a commitment to ethical standards, ensuring equitable access and informed consent. This dynamic landscape demands transparency, collaboration, and continual reflection upon the societal impact of engineering. Ethical frameworks serve as compasses, guiding actions towards a future where technological advancement supports communal wellness, justice, and an inclusive global society, fostering trust and shared progress in the ever-evolving human narrative.",long,medium,abstract,2nd,present
engineering,descriptive,plain,Grade8,Inside the Vehicle Manufacturing Plant,"Inside the vehicle manufacturing plant, machines and humans work together. Robots weld car frames with sparking precision, while workers inspect components. Conveyer belts move parts along, connecting each stage like a mechanical dance. The air vibrates with sounds of industry—clanging metal, humming engines, and the beep of forklifts. Bright lights illuminate each workstation, highlighting the intricate process. Engineers monitor the assembly line, ensuring quality and efficiency at every step. Panels and wheels join with a methodical rhythm, crafting vehicles ready for the open road. It’s an impressive operation, combining skill and technology to bring designs to life, creating machines that take people everywhere.",short,low,concrete,3rd,present
