domain,mode,tone,reading_level,title,paragraph,style.sentence_length,style.figurative_language,style.concreteness,style.viewpoint,style.temporal_focus
life_sciences,narrative,plain,Grade8,The Ants' Journey,"In the bright morning light, a column of ants ventured from their nest, each carrying a tiny piece of leaf. The air was cool and refreshing as they navigated through the grassy terrain. Following an invisible trail of pheromones, they moved with determination toward their destination. A wide puddle posed a challenge, but the ants cleverly formed a living bridge across it. As the sun rose higher, their progress slowed, yet they persevered, never straying from their path. By afternoon, the weary travelers had returned to their colony, delivering their leafy cargo to prepare for the oncoming rain.",mixed,low,concrete,3rd,past
life_sciences,expository,formal,Grade12,Photosynthesis Process Overview,"Photosynthesis, fundamentally essential for sustaining life on Earth, is a complex process used by plants, algae, and certain bacteria to convert light energy into chemical energy. During this process, chlorophyll within chloroplasts absorbs sunlight, facilitating the transformation of carbon dioxide and water into glucose and oxygen. The light-dependent reactions, occurring in the thylakoid membranes, generate ATP and NADPH, which are then utilized in the Calvin cycle within the stroma to synthesize glucose. This intricate biochemical sequence not only serves as the primary source of organic compounds for autotrophs but also forms the basis of the food chain, impacting various ecological systems and processes.",long,none,mixed,3rd,present
life_sciences,descriptive,technical,Undergraduate,Coral Reef Ecosystems,"A coral reef, a vibrant underwater ecosystem, thrives with diverse marine life. The corals, composed of calcium carbonate structures, support an array of species. Tiny fish dart between the branches. Sea anemones wave their stinging tentacles. Parrotfish, with strong beaks, graze on algae covering the corals. The symbiotic relationship between corals and zooxanthellae, microscopic algae, is crucial. The algae photosynthesize, providing nutrients to the coral. This biodiversity hotspot mirrors a bustling metropolis. Each organism plays a vital role in maintaining the reef's health, contributing to its intricate web of life. Threats like bleaching and pollution endanger this delicate balance.",short,low,concrete,3rd,present
life_sciences,process_explanation,reflective,Graduate,Evolution of Plant Adaptations,"The evolution of plant adaptations offers a profound example of nature's capacity for complexity and resilience against ever-changing environmental conditions. Looking forward, these adaptations will continue to manifest in response to global climatic shifts, prompting plants to modify their physiological and structural traits to survive and thrive. This evolutionary trajectory encompasses subtle genetic mutations, selective pressures, and ecological interactions, all shaping novel features, such as drought-resistant cuticles or salt-tolerant root systems. As anthropogenic influences accelerate environmental changes, the evolutionary pace may amplify, potentially driving the emergence of remarkable plant species that could redefine ecosystems and influence biodiversity patterns across habitats.",long,medium,abstract,3rd,future
life_sciences,persuasive,conversational,Grade8,Saving the Bees,"Imagine a world without the buzz of bees, where flowers droop in silence and fruits struggle to form. You might think bees are just another insect, but they're crucial for our survival. With every flower they visit, bees not only collect nectar but also transfer pollen, ensuring plants reproduce and thrive. Our food chain relies heavily on their unassuming labor. By planting native flowers and reducing pesticide use, you're waving a magic wand over your garden, transforming it into a bee haven. Let's take a stand for these buzzing heroes who work tirelessly to keep nature's clockwork ticking smoothly.",mixed,high,mixed,2nd,present
life_sciences,narrative,technical,Undergraduate,The Biologist's Expedition,"Dr. Elena Sanchez set off on an ambitious expedition to the Amazon rainforest, her heart echoing with excitement and determination. Armed with an array of scientific instruments, she aimed to document the region's unparalleled biodiversity. Traversing dense undergrowth teeming with hidden life, she encountered myriad species previously unseen, noting intricate behaviors and adaptations with meticulous care. The forest resonated with the calls of elusive birds, while primates swung gracefully through the canopy. Sanchez's observations contributed immensely to understanding ecological networks, shedding light on complex interdependencies within this vibrant biome. Her study underscored the urgency of conserving such invaluable natural heritage.",long,medium,mixed,3rd,past
life_sciences,expository,plain,Graduate,Genetic Drift Explained,"Genetic drift represents a mechanism of evolution that involves random fluctuations in allele frequencies within a population. Unlike natural selection, which favors advantageous traits, genetic drift arises from chance events that can lead to significant genetic variation. In small populations, these random changes can have pronounced effects, potentially causing allele fixation or loss. Over time, genetic drift can alter the genetic makeup of a population, impacting biodiversity and evolutionary trajectories. Historical instances, such as population bottlenecks or founder effects, illustrate how genetic drift can shape species' genetic landscapes, highlighting its role in the broader evolutionary process.",mixed,none,abstract,3rd,past
life_sciences,descriptive,conversational,Grade12,Exploring the Rainforest Canopy,"Walking through a rainforest's towering canopy feels like stepping into another world. Vines twist like curious serpents, while leaves form a dense, emerald ceiling above. The air is thick with the scent of earth and flora, almost palpable with moisture. Birds with vibrant plumage flit between branches, their calls echoing through the green expanse. Butterflies, painted in nature's brightest hues, dance around, sharing secrets with the wind. Every inch teems with life, from the tiny insects that scuttle beneath stones to the mighty trees towering skyward. This elevated realm breathes with ancient mysteries, offering new discoveries at every turn.",mixed,low,concrete,1st,present
life_sciences,process_explanation,technical,Undergraduate,Cell Division Stages,"Cell division is a fundamental process in biological organisms. It involves several stages. Initially, during interphase, the cell prepares by replicating its DNA. Next is prophase, where chromosomes condense, and the mitotic spindle forms. Metaphase follows, aligning chromosomes at the cell's equatorial plate. Anaphase occurs as sister chromatids separate, pulled toward opposite poles. In telophase, nuclear membranes reform around the chromatids. Finally, cytokinesis divides the cytoplasm, producing two daughter cells. This sequence ensures genetic consistency across generations. Understanding these stages highlights the intricacy of life and showcases the remarkable processes sustaining cellular and organismal continuity.",short,none,abstract,3rd,present
life_sciences,persuasive,formal,Graduate,The Imperative of Biodiversity Conservation,"As we venture further into the Anthropocene, preserving biodiversity emerges as a paramount challenge, necessitating urgent and comprehensive action. Biodiversity, the rich tapestry of life encompassing genetic, species, and ecosystem diversity, underpins Earth's ecological resilience. Its preservation is critical for ensuring ecosystem productivity and stability, which directly support human livelihoods and wellbeing. Emerging research underscores the intricate links between biodiversity and ecosystem services, including climate regulation, pollination, and disease control. Hence, fostering global cooperation in conservation efforts, integrating indigenous knowledge, and developing innovative policy frameworks will be essential to safeguard this vital natural legacy for future generations.",long,medium,abstract,3rd,future
life_sciences,narrative,playful,Grade12,A Day in the Butterfly Garden,"Yesterday, I found myself in a kaleidoscope of color—a butterfly garden brimming with life. As I wandered through, whimsical wings fluttered around, like tiny canvases painted with dawn's palette. The air buzzed with delicate susurrations, each flit an ode to the flowers they kissed. Golden sunbeams danced on petals, as vivid as the butterflies themselves. A curious Monarch landed on my finger, its touch as light as a whisper, and for a moment, I held a piece of magic. The garden breathed stories of metamorphosis, each butterfly a testament to transformation. It was an entrancing realm where dreams took flight.",mixed,high,concrete,1st,past
life_sciences,expository,reflective,Undergraduate,The Role of Fungi in Ecosystems,"Fungi play an indispensable role within ecosystems, acting as principal decomposers and nutrient recyclers in natural environments. As you delve into their world, it's fascinating to realize that these organisms serve as nature's janitors, breaking down complex organic matter into simpler forms that enrich the soil. Their underground mycelial networks, often extensive and interconnected, facilitate nutrient and water exchange, supporting plant growth and soil health. This interdependence highlights the intricate web of life, where fungi form quiet yet critical partnerships with flora, ensuring ecosystem resilience. Understanding these relationships underscores the profound, unseen contributions of fungi to ecological balance.",long,medium,mixed,2nd,present
life_sciences,descriptive,formal,Graduate,Structure of DNA,"DNA, or deoxyribonucleic acid, exhibits a remarkable structure underpinning genetic information storage. This structure comprises a double helix formed by two polynucleotide chains coiling around each other, stabilized through hydrogen bonds between complementary base pairs: adenine with thymine, and cytosine with guanine. Each nucleotide, consisting of a phosphate group, a sugar molecule (deoxyribose), and a nitrogenous base, forms the fundamental unit of DNA. The helical arrangement not only lends structural stability but also facilitates mechanisms of replication and transcription, ensuring the fidelity of genetic information across cellular generations, thus playing a crucial role in heredity and evolution.",long,low,concrete,3rd,present
life_sciences,process_explanation,plain,Grade8,How Seeds Sprout,"When you plant a seed in the soil, an amazing process unfolds. Initially, the seed absorbs water, swelling and eventually breaking its outer coat. Inside, the embryo begins to grow. The first visible sign is the tiny root pushing downward, seeking nutrients and stability. Next, a small shoot emerges, pushing toward the sunlight. This shoot grows leaves, allowing the young plant to start photosynthesizing, creating its own food. As time passes, the plant continues to grow, developing more roots, stems, and leaves. By understanding this journey from seed to plant, you appreciate the incredible cycle of nature and life.",mixed,none,mixed,2nd,present
life_sciences,persuasive,technical,Undergraduate,Advancements in Genetic Engineering,"In contemporary scientific discourse, genetic engineering emerges as a pivotal tool for addressing diverse challenges within agriculture and medicine. Its advancements enable precise genomic alterations, facilitating the development of crops with enhanced resistance to pests and environmental stressors, thereby augmenting food security. Concurrently, in the medical field, gene therapy represents a beacon of hope for treating genetic disorders, offering potential cures through direct genetic modification. These innovations underscore the capacity of genetic engineering to revolutionize traditional paradigms, presenting a compelling case for its strategic integration into global development initiatives. However, ethical considerations remain paramount to guide its responsible application.",long,none,abstract,3rd,present
life_sciences,narrative,reflective,Graduate,The Botanist's Legacy,"Looking back, Dr. Harrington's life's work in botany reads like a saga of discovery and dedication. Her pioneering research on plant communication opened new windows into understanding how flora interact with their environment. As she planted the seeds of curiosity in her students, her legacy was already taking root. Years from now, the gardens she nurtured will bloom with the wisdom she imparted. Her insights, echoing through the lecture halls, will inspire future generations, driving them toward further exploration of the plant kingdom. Although the landscape of science constantly evolves, the principles she established will continue to flourish timelessly.",mixed,medium,mixed,3rd,future
life_sciences,expository,playful,Grade8,The Wonders of Pollination,"Pollination is nature's magical dance, ensuring plants grow their delicious fruits and seeds. Buzzing bees, hovering hummingbirds, and even the wind join this grand ballet, moving pollen from one blossom to another. When you watch a bee diving into a flower, it's like witnessing a tiny treasure hunt. Each grain of pollen carried away becomes a promise of new life. This process might seem small, but it's a gateway to the bountiful gardens we enjoy. Next time you sip a sweet fruit smoothie, remember the busy partners in nature's orchestra that made it all possible. Pollination truly is a wonder!",mixed,medium,concrete,2nd,present
life_sciences,descriptive,technical,Graduate,Ecology of Mangrove Forests,"Mangrove forests, thriving in coastal intertidal zones, display unique ecological characteristics integral to marine and terrestrial systems. Their dense, intertwining roots offer critical habitat for myriad aquatic species, from juvenile fish to crustaceans, serving as rich nursery grounds. These roots also stabilize sediments, significantly mitigating coastal erosion while filtering pollutants. The aboveground structures provide refuge for an array of birdlife, serving essential functions in global biodiversity conservation. Mangroves' ability to sequester carbon within their soils underscores their vital role in climate regulation. Understanding the complex interrelationships within this ecosystem highlights the broader implications for ecological resilience and conservation strategies.",long,medium,mixed,3rd,present
life_sciences,process_explanation,conversational,Grade12,How Birds Migrate,"When I first learned about bird migration, it seemed like a wondrous journey painted across the skies. During migration, birds navigate vast distances, guided by Earth's magnetic fields, celestial bodies, and even olfactory cues. They usually travel along established routes, called flyways, acting like avian highways in the sky. Before setting off, they undergo a phase called hyperphagia, where they dramatically increase food intake to store energy. These fliers often travel at night to avoid predators and maintain cooler body temperatures. Reflecting on this process, I'm amazed by nature's intricacies and the birds' innate ability to endure such epic voyages.",mixed,low,concrete,1st,past
life_sciences,persuasive,plain,Undergraduate,Why Study Microbiology,"Studying microbiology is essential for tackling many global issues. As a field, it uncovers the unseen universe of bacteria, viruses, and fungi. These microorganisms play fundamental roles in ecosystems and human health. Exploring microbiology helps develop new antibiotics, understanding pathogen mechanisms and discovering novel biotechnologies. By delving into this subject, you empower yourself to contribute to advancements in medicine and agriculture. With climate change and emerging diseases posing increasing challenges, microbiologists' work becomes more critical. Embark on this journey to make impactful discoveries, influencing the future and fostering a deeper appreciation for the microscopic world around us.",short,medium,mixed,2nd,future
life_sciences,narrative,formal,Graduate,Futuristic Botanical Innovations,"In the realm of futuristic botanical innovations, envision vertical farms utilizing hydroponic systems that redefine urban agriculture, exemplifying the seamless fusion of technology and biology. These structures, rising amidst cityscapes, will implement AI-driven sensors to optimize conditions for plant growth, addressing food security concerns in increasingly populated urban areas. Hydroponics, bypassing traditional soil use, allows for efficient nutrient delivery, fostering accelerated plant development. This technological paradigm shift promises to minimize agricultural footprints, economizing water use and resource inputs. As these advancements take root, they signify a transformative era, offering sustainable solutions to future ecological and urban challenges.",long,none,mixed,3rd,future
life_sciences,expository,technical,Grade12,The Impact of Acid Rain on Forests,"Acid rain, caused by atmospheric pollutants such as sulfur dioxide and nitrogen oxides, has significant detrimental effects on forest ecosystems. When these pollutants mix with water vapor, they form acidic compounds that precipitate, damaging foliage and leaching essential nutrients from the soil. This process weakens trees' resistance to disease and extreme weather. Additionally, acid rain disrupts soil microbiota, impacting nutrient cycling and reducing forest productivity. Some forests, with specific soil compositions, are more susceptible to acidification, necessitating targeted conservation strategies. Understanding these impacts informs mitigation efforts and highlights the importance of reducing emissions to protect forest health.",mixed,none,abstract,3rd,present
life_sciences,descriptive,reflective,Undergraduate,The Tranquility of a Countryside Walk,"Strolling through the countryside, I found solace in the untouched beauty of the rolling hills. Wildflowers, like flecks of color on a lush green canvas, swayed gently in the breeze. The scent of earth and grass, faint and comforting, mingled with the melody of birdcalls echoing above. Each step felt like a gentle whisper of peace, as though the land itself was inviting reflection. As cows grazed lazily under a wide blue sky, their presence seemed to signal an unspoken balance with nature, a reminder of life's simpler rhythms. It was a fleeting but profound connection to the world around me. .",mixed,medium,concrete,1st,past
life_sciences,process_explanation,formal,Undergraduate,Photosynthesis and Respiration,"Photosynthesis and respiration constitute critical physiological processes in plants, underlying fundamental energy transformations. Photosynthesis involves chlorophyll-mediated conversion of light energy into chemical energy, with the synthesis of glucose and oxygen as principal outputs. This process predominantly occurs in chloroplast-containing cells. Conversely, respiration represents the metabolic pathway wherein glucose undergoes enzymatic degradation into carbon dioxide, water, and energy, manifesting as ATP. These complementary processes facilitate the assimilation and subsequent utilization of energy, supporting plant growth and development. Integrating these biochemical pathways ensures cellular homeostasis, emphasizing the intricate balance between energy generation and consumption intrinsic to plant life.",long,none,abstract,3rd,present
life_sciences,persuasive,conversational,Grade8,Why Remember Endangered Animals,"Picture a future without the roar of tigers or the majesty of elephants. These beautiful creatures stand on the brink of disappearance. It's important to remember and protect them. They are part of a magnificent tapestry of life, each playing a vital role in their ecosystems. By helping endangered animals, you ensure biodiversity thrives. You can plant a tree, donate to a wildlife fund, or simply spread awareness. Each small step saves part of our natural world. Let's keep the dreams of jungles alive by cherishing their inhabitants. The future can still hold the echoes of their mighty presence.",short,high,mixed,1st,future
life_sciences,narrative,technical,Grade12,Mapping the Human Genome,"The Human Genome Project marked a profound achievement in genetic research. Scientists meticulously documented the entire sequence of nucleotides that make up human DNA. This monumental task spanned over a decade, requiring collaboration across disciplines. With precision, they identified approximately 20,000 to 25,000 genes. Each gene coded for proteins essential to life's processes. The project's completion unlocked new pathways in understanding genetic diseases. Diagnostic techniques improved, offering potential for personalized medicine. Researchers now explore gene functions, examining their roles in complex traits. This groundbreaking endeavor paved the way for advancements in genomics, shaping the future of biological sciences.",short,low,concrete,3rd,past
life_sciences,expository,reflective,Graduate,Climate Change and Marine Ecosystems,"Marine ecosystems, vast and diverse, experience profound transformations due to climate change, challenging the resilience of oceanic life. Elevated temperatures induce coral bleaching, undermining the structural integrity of coral reefs, which serve as crucial biodiversity hotspots. Concurrently, increased atmospheric CO2 levels drive ocean acidification, impairing calcifying organisms, including mollusks and some plankton species. These shifts influence broader trophic dynamics, affecting fish populations and, consequently, human communities reliant on marine resources. Historical analysis of oceanographic data reveals shifting baselines, emphasizing the imperative for robust conservation strategies to mitigate the anthropogenic impacts on these vital ecosystems and preserve their ecological functions.",long,medium,abstract,3rd,past
life_sciences,descriptive,plain,Undergraduate,Sunset at the Marsh,"At sunset, the marsh transforms into a tapestry of colors. Golden hues stretch across the sky, casting reflections on the water's surface. Egrets, with their snowy plumage, stand in stark contrast against the vivid background. The air is filled with the soothing sounds of rustling reeds and distant birdcalls. Fish ripple the water, leaving gentle circles that expand outward. As the sky darkens, the stars begin to twinkle over the tranquil landscape. This serene environment provides a sanctuary for wildlife and a moment of peace for those who visit. Nature's beauty, undisturbed, thrives quietly in the marsh's embrace.",short,low,concrete,3rd,present
life_sciences,process_explanation,reflective,Grade12,The Journey of a Raindrop,"As a child, I loved imagining the journey of a raindrop, falling from a cloud and embarking on its watery adventure. Once it lands, it might seep into the earth, joining a river beneath the soil. It travels through layers, slowly nourishing the roots of plants. Some drops gather in streams, winding through forests and fields, charting a path to the sea. Along the way, a raindrop might briefly become morning dew or freeze as snow. Each transformation is part of an endless cycle, a gentle dance that shapes landscapes and sustains lives. Reflecting on this, I find beauty in water's quiet resilience.",long,medium,mixed,1st,past
life_sciences,persuasive,technical,Graduate,The Necessity of Ecological Restoration,"Ecological restoration stands as a critical component in addressing environmental degradation, offering a scientifically grounded approach to rehabilitating ecosystems. This process involves active interventions such as reforestation, wetland reconstruction, and soil remediation, aiming to restore native biodiversity and ecological functionality. Current research underscores the intrinsic value of restoration, highlighting its potential in carbon sequestration, erosion control, and habitat provision. As global biodiversity faces unprecedented threats, strategic restoration initiatives could mitigate biodiversity loss, fostering ecosystem resilience and sustainability. Investment in this domain, along with adaptive management strategies, holds promise for a sustainable coexistence with our natural world.",mixed,low,abstract,3rd,present
life_sciences,narrative,conversational,Grade8,The Day I Found a Fossil,"One sunny afternoon, I stumbled upon a fossil while hiking. The ground was warm beneath my feet, and the air hummed with the sound of crickets. I knelt down to inspect a peculiar rock and realized it was the imprint of an ancient creature's shell. Holding it in my hands, I felt a connection to a time long before humans roamed the earth. It was thrilling to imagine the world this creature lived in, where lush ferns and towering trees covered the landscape. That fossil sparked my curiosity, inspiring a lifelong love for paleontology and the stories hidden within the earth's crust. . . . . . . . . . . . .",mixed,medium,concrete,1st,past
