domain,mode,tone,reading_level,title,paragraph,style.sentence_length,style.figurative_language,style.concreteness,style.viewpoint,style.temporal_focus
physical_sciences,narrative,plain,Grade8,A Day at the Science Fair,"At the science fair last weekend, I saw an incredible demonstration that involved magnets and electricity. One booth had an electromagnet that could lift a table of metal objects, removing the need for me to use my hands. The presenter explained how wrapping copper wire around an iron core and passing electric current through the wire could turn the entire setup into a powerful magnet. At first, I watched in awe as the iron filings aligned perfectly along invisible lines of force. I picked up a few small metal nails and dropped them near the magnetized core, giggling when they snapped into place. The presenter further showed us how the strength of this magnetic force could be increased by turning up the voltage on a simple battery connected to the wire. With a flick of a switch, the tiny motor powered up, helping us understand not only how a basic electromagnet worked but also how the practical applications could extend to things like electric trains or cranes. I left the booth feeling electrified myself and much more curious about the world of physics.",mixed,low,concrete,1st,past
physical_sciences,expository,formal,Grade12,The Dynamics of Fluid Motion,"Fluid dynamics is a sub-discipline of fluid mechanics that describes the flow of fluids—liquids and gases. Understanding fluid dynamics is essential for analyzing how fluids interact with their surroundings, whether in natural or engineered environments. In this domain, the Bernoulli's Equation is frequently employed, representing the conservation of energy in a fluid stream. Essentially, it states that an increase in the velocity of a fluid occurs simultaneously with a decrease in pressure or a decrease in the fluid's potential energy. This principle has profound implications in various fields such as aerodynamics, hydrodynamics, and even meteorology. For instance, engineers utilize these dynamics to design efficient aircraft wings, ensuring lift by manipulating flow patterns. Meanwhile, meteorologists predict weather patterns largely through the study of atmospheric fluid dynamics. Despite the complexity of equations and models used to represent fluid behavior, the fundamental principles remain rooted in observable phenomena, such as the movement of rivers, airflow over a car's body, or even the boiling of water, making fluid dynamics a highly tangible and practical area within physical sciences.",long,none,mixed,3rd,present
physical_sciences,descriptive,technical,Undergraduate,Anatomy of a Circuit Board,"A typical circuit board, known formally as a printed circuit board (PCB), comprises multiple layers of embedded components, critical for the functioning of electronic devices. At its foundation, a thin, non-conductive substrate, often fiberglass, offers structural support. Above this base, intricate copper traces map out comprehensive electrical pathways, guiding electric flow to various components accurately. One can find numerous components soldered onto these traces, each serving unique roles. Resistors, for example, control current flow, ensuring it's at levels ideal for device operation. Capacitors, shaped like tiny barrels, store and release electric energy as required. Meanwhile, microchips, appearing as small black rectangles, house integrated circuits performing complex processing tasks. Visual inspection of a PCB reveals tiny soldered junctions, known as vias, that allow connections to upper layers, expanding the circuit's functionality. The delicate dance of electrons within these boards underscores the marvels of modern electronics engineering, enabling sophisticated operations ranging from simple lighting control to advanced computational processes. Such intricacies highlight the ingenuity behind our everyday electronic conveniences.",mixed,none,concrete,3rd,present
physical_sciences,process_explanation,reflective,Graduate,Transforming Solar Energy into Electricity,"Converting solar energy into electricity is a multi-layered process that can be likened to harnessing a river of potential. Begin with photovoltaic cells, often in the form of flat, semitransparent panels, which serve as the initial interaction point for sunlight. These cells contain semiconductor materials, typically silicon, that absorb photons from sunlight. When these photons collide with the semiconductor, they dislodge electrons, creating a flow—a current—within the cells. This direct current (DC) is then channeled through inverter systems, transforming it into alternating current (AC) suitable for home or commercial use. This transformation is managed by inverters that, remarkably, convert the electrical flow akin to translating chaos into a harmonious symphony of usable energy. As these electrons move through the maze of wires and circuit paths, every twist and turn signifies a step closer to energizing a light bulb or powering a computer. This process is not merely technical but almost poetic, a subtle dance of energy moving from the cosmos to the mundane, resulting in the illumination of our nights and the empowerment of our devices. Reflecting on this process, one can't help but marvel at how a simple ray of sunlight can transform, through human ingenuity, into currents that light our world.",long,medium,abstract,1st,present
physical_sciences,persuasive,conversational,Grade12,Why Learning Physics is Beneficial,"Imagine a future where you understand the very forces that govern our universe, from the tiniest particles to the expansive galaxies. Learning physics offers you this key. It's not just about equations and laws; it's about unlocking secrets from everyday life to cosmic phenomena. Consider for a moment the devices you interact with daily—your smartphone, your car, even the simple pencil on your desk. All these rely on principles of physics for their existence and operation. Understanding these principles transforms how you engage with the world around you. More than just theoretical knowledge, physics teaches critical thinking, problem-solving, and the ability to analyze complex situations. By learning the intricate dance of molecules or the majesty of electromagnetic waves, you enhance your ability to make informed decisions and innovate. As global challenges like climate change and energy demands escalate, those equipped with a solid grasp of physics will lead the charge in resolving them. Why wait? Dive into physics and position yourself for a future brimming with possibilities. It's not just a study; it's the comprehension of existence itself.",mixed,low,mixed,2nd,future
physical_sciences,narrative,technical,Graduate,The Day of the Eclipse Study,"During the solar eclipse of July 2020, a small group of astrophysicists embarked on an expedition to a remote plateau with clear atmospheric conditions and minimal light pollution. Their goal was to capture high-resolution data on solar coronal mass ejections using advanced spectroscopy. Each telescope was meticulously aligned with celestial coordinates, a process requiring extreme precision to ensure correct focal points. As the moon began its celestial traverse, temporarily obscuring the sun, a chill settled, indicating the onset of totality. Instruments sprang to life, simultaneously recording dozens of variables—luminosity, magnetic field fluctuations, and spectral emissions. The temporal and spatial resolution of these observations would, they hoped, unravel mysteries surrounding solar wind acceleration processes. Prepared to model complex plasma interactions, the team meticulously collected terabytes of data over the eclipse's brief duration. Post-event, this data would undergo rigorous computational analysis using state-of-the-art algorithms, promising insights into not just solar physics, but also broader cosmic phenomena such as exoplanetary atmosphere studies. The eclipse, transient yet profound, left an indelible impact, poised to expand the horizons of human knowledge.",long,none,abstract,3rd,past
physical_sciences,expository,reflective,Undergraduate,Understanding Quantum Entanglement,"Quantum entanglement is a phenomenon within the realm of quantum mechanics that defies our conventional understanding of correlation and separateness. Imagine two particles that somehow become linked in such a way that the state of one instantaneously influences the state of the other, regardless of the distance separating them. During my initial encounters with this concept, I grappled with the counterintuitive nature of such instantaneous interconnectivity, which seemed to overtly challenge relativity's emphasis on the finite speed of light as a limit for information transfer. This phenomenon is vividly encapsulated in the EPR paradox, an intellectual construct posited by Einstein, Podolsky, and Rosen to question the completeness of quantum mechanics. Over time, successive experimental validations, notably those exploring Bell's Theorem, affirmed the realness of entanglement, eroding the walls between theoretical possibility and observable reality. Reflecting on quantum entanglement, one discerns that it extends beyond mere scientific curiosity, instead hinting at an intrinsic interweaving of reality itself, inviting physicists to reconsider the foundational principles of causality and locality that underpin classical science. This awe-inspiring hallmark of quantum mechanics invites us to contemplate the cosmos as a vast, interconnected tapestry where unseen threads bind the most disparate elements of existence.",long,medium,mixed,1st,past
physical_sciences,descriptive,conversational,Grade8,Exploring the Night Sky,"Looking up at the night sky, you might feel a sense of wonder. There, twinkling against the black canvas, are countless stars, each a massive ball of fiery gas millions of miles away. Constellations, like Orion and Ursa Major, form stories told across generations. The moon, with its bright, round shape, seems to light up the night all on its own. If you have a telescope or even a set of binoculars, you can see the surface of the moon full of craters and plains, evidence of impacts that happened over billions of years. Focus your gaze further away to spot the planets in our solar system—Jupiter, with its swirling storm bands, or Saturn, adorned with its iconic rings. Beyond our solar system, the Milky Way stretches its arm across the sky, a band of light made from billions of stars. Occasionally, you might catch a shooting star, actually a meteor burning up in Earth's atmosphere. Imagining the immensity and beauty of the universe above you, even on a simple evening outside, gives a glimpse into the mysteries and marvels that await in the world of astronomy.",mixed,low,concrete,2nd,present
physical_sciences,process_explanation,plain,Undergraduate,Building a Simple Wind Turbine,"Creating a basic wind turbine starts with selecting the location, ensuring it's an area with consistent wind speeds to maximize energy capture. The first step involves setting up a sturdy tower, often fabricated from metal, which will support the entire structure. For simplicity, you can use a small, pre-manufactured turbine kit, especially designed for educational purposes. The next phase includes attaching the rotor blades to a central hub, carefully aligning them to ensure efficient aerodynamic performance. Once assembled, this rotor is mounted atop the tower, connected to a shaft that runs vertically down the structure. At the bottom, you'll find a generator that converts the kinetic energy from the spinning blades into electricity. The generator is linked to a power control system to regulate voltage levels, protecting connected devices. Finally, you’ll connect it to a power storage system or direct output. With the assembly complete, testing occurs to ensure operational efficiency, adjustments to blade angles and tension may be necessary to optimize performance. Eventually, this modest turbine will transform the mechanical motion created by wind into useful electrical energy, serving as a practical demonstration of sustainable energy principles. Though starting small, such projects cultivate an understanding of renewable technologies that could spur innovative solutions in our evolving energy landscape.",long,low,abstract,2nd,future
physical_sciences,persuasive,technical,Graduate,Renewing Faith in Nuclear Energy,"As global energy demands continue to rise, revisiting nuclear energy remains imperative. This power source, often overshadowed by concerns of safety and waste, offers one of the most efficient and reliable means to generate electricity without emitting greenhouse gases. Contemporary nuclear reactors, backed by advancements in technology, have overcome many historical challenges. These innovations include enhanced passive safety systems, which inherently stabilize reactor conditions in emergencies. Developers are also exploring advanced fuel cycles to minimize waste production. Notably, next-generation reactors promise a higher degree of sustainability, utilizing spent fuel more efficiently and significantly reducing radiotoxicity. Moreover, nuclear power stands as a robust alternative to fossil fuels, capable of producing large-scale energy independent of weather conditions—a notable advantage over solar and wind technologies, which remain contingent on variable climatic factors. Critics often point to past incidents, yet a transparent analysis reveals that modern reactors incorporate lessons learned, facilitating robust risk mitigation strategies. Given the escalating consequences of climate change, the case for nuclear energy becomes even more compelling. By embracing nuclear energy, societies can stride confidently towards carbon neutrality while ensuring the stability and security of energy supplies for future generations.",mixed,medium,mixed,3rd,present
physical_sciences,narrative,reflective,Undergraduate,The Chemistry of Change,"The summer I spent in the university chemistry lab was transformative. Initially, I perceived reactions purely through the mechanistic lens of formulas and equations, akin to solving puzzles. Yet, witnessing these reactions unfold in reality challenged that view, infusing mundane equations with vivid life. Each experiment felt like a new symphony where reagents played their roles, sometimes in unexpected harmonies. During one particular reaction involving copper sulfate and zinc, I watched as solutions danced and colors intertwined, shifting from blue to a mesmerizing golden hue. The routine task of titration became an art form, the carefully measured addition of one solution to another felt akin to the deliberate strokes of a painter's brush. Reflecting, I understood chemistry as an exploration of transformation at its core, symbolizing change that occurs not only in test tubes but within us. Experiments became metaphors for life's processes—creation and destruction, order and chaos. Balancing reactions mirrored finding equilibrium amidst life’s turmoils. Through these experiences, chemistry ceased to be merely academic, emerging instead as a profound lens through which the very fabric of change, both tangible and intangible, could be understood.",long,medium,abstract,1st,past
physical_sciences,expository,plain,Undergraduate,The Role of Gravity in the Universe,"Gravity is a fundamental force that plays a crucial role in shaping the universe. At its core, gravity is the attraction between objects that have mass, drawing them towards each other. This simple principle governs the motion of planets, stars, and galaxies. For instance, gravity keeps the planets in our solar system in orbit around the sun, providing the stability necessary for life on Earth. In a broader cosmic context, gravity influences the formation of galaxies, causing gas and dust to collapse over eons into stars and planets. Meanwhile, black holes, regions of space where gravity is so intense that nothing can escape, demonstrate gravity’s more extreme and mysterious aspects. Einstein’s theory of General Relativity gives us a deeper understanding of gravity, describing it as a curvature of spacetime around massive objects. This innovative framework helps scientists predict phenomena like gravitational waves, ripples in spacetime caused by violent cosmic events. While gravity may seem an everyday affair, it is an ever-present force in the cosmic ballet, orchestrating the dance of celestial bodies, shaping the structure of the universe itself.",mixed,low,mixed,3rd,present
physical_sciences,descriptive,playful,Grade12,A Stroll Through the Wonderland of Physics,"Strolling through the world of physics is akin to wandering through an enchanting wonderland. Each corner holds phenomena that tickle the imagination and challenge perceptions. Imagine yourself in a room of mirrors, reflecting beams of light—a direct demonstration of optics. Step a little further into the realm of particles colliding like enthusiastic dancers at a cosmic ball, demonstrating the electrifying chaos of atomic interactions. As you saunter through this world, you find yourself lifted by invisible hands—the buoyant force that water exerts, a hallmark of fluid mechanics. But wait, what's that? A cat in a box, alive and not—Schrodinger’s paradox reminding us of quantum uncertainties mingling with daily curiosities. Even gravity seems more than just a force, presenting itself as a playful, invisible friend always keeping the planet beneath your feet. Physics personifies the mundane and transforms it into a grand spectacle. It teases mysteries from the commonplace and invites you to partake in the dance of energies swirling around. So, you realize, physics isn't just about math and models; it's about interpreting every quirk and quark in the universe, with a sense of playful awe.",mixed,medium,concrete,1st,present
physical_sciences,process_explanation,technical,Graduate,Energy Conversion in Fuel Cells,"Fuel cells are devices that convert chemical energy directly into electrical energy through an electrochemical process rather than combustion. The process begins with the introduction of hydrogen gas to the anode side of the cell, where hydrogen molecules dissociate into protons and electrons due to the catalytic action on the anode's surface. These electrons then navigate through an external circuit, thereby generating electric current. Concurrently, protons traverse a polymer electrolyte membrane toward the cathode. At the cathode, oxygen gas combines with these protons and the returning electrons, facilitated again by a catalyst, to form water as a byproduct—a reaction that completes the circuit and allows for continuity of electrical flow. This fundamental process illustrates the high efficiency of fuel cells as energy converters, producing a direct and steady supply of electricity with minimal environmental impact. In contrast to traditional energy conversion processes, fuel cells minimize energy losses and reduce undesirable emissions, making them an attractive option in the quest for sustainable and clean energy solutions across various sectors, from vehicular applications to stationary power generation systems.",long,none,abstract,3rd,present
physical_sciences,persuasive,plain,Grade8,The Value of Studying Earthquakes,"Studying earthquakes can seem daunting, but it is very important. Earthquakes show us how powerful our planet is. They teach us about the forces moving under our feet. By understanding these forces, we can build stronger buildings. We can also make better safety plans. This knowledge saves lives. Scientists use special tools to study earthquakes. These tools help predict when an earthquake might happen. Knowing this can help people to prepare. It is like having a weather forecast for earthquakes. Plus, studying earthquakes helps us understand tectonic plates. These plates make up the Earth's surface. Learning about them explains mountains, volcanoes, and oceans. So, learning about earthquakes helps us know more about the Earth. And knowing this can keep us safer and smarter.",short,low,concrete,2nd,present
physical_sciences,narrative,playful,Grade12,The Physics-Prank Day,"Every April, the confines of our physics lab turn into a playground of mischief, a tradition where equations meet eccentricity. It's Physics-Prank Day, a celebration of curiosity and creativity, where laws of science playfully break free from their textbooks. This year, we devised our grand trick by concocting a faux perpetual motion machine. Picture this: balls rolling uphill, seemingly defying gravity's grasp, bewildering the uninitiated observer. The secret lay in optical illusions—angled mirrors tricking the eye. The unsuspecting first-year students gaped, their faces a mosaic of disbelief and delight, as we experienced firsthand the exhilaration of shared discovery under the guise of tomfoolery. Tiny ribbons, subtly imbued with static electricity, clung to their hair, creating halos that buzzed like bees. Amid the laughter, a helium-filled balloon, wearing a comically contorted Einstein mask, ascended to the ceiling. The silliest ideas sparked the greatest conversations, diving from prank to profound: ""What is motion after all? Isn't everything relative?"" As the day ended, we vowed not just to learn, but to revel in possibilities, seeing physics not as a rigid set of rules but as an ever-turning kaleidoscope of wonders.",mixed,high,abstract,1st,present
physical_sciences,expository,reflective,Graduate,The Legacy of a Discovery,"The discovery of the Higgs boson at CERN in 2012 was more than a significant milestone; it was a gateway, opening paths to mysteries once beyond human comprehension. This elusive particle, often dubbed the 'God Particle,' is responsible for endowing other particles with mass, a key component in the Standard Model of particle physics. Prior to its discovery, the theory intriguingly speculated about why objects in the universe have mass but lacked empirical substantiation. The confirmation of the Higgs boson's existence substantiated theoretical predictions, undergirding decades of scientific inquiry with tangible proof. It was an achievement heralded by a symphony of international collaboration, perseverance, and human ingenuity, resonating across the scientific community. The ripple effect of this discovery permeated various domains, inspiring new frameworks in cosmology and advancing technologies in data processing and accelerator design. Reflecting on this profound achievement underscores a broader philosophical contemplation of science as both a pursuit of knowledge and an epic narrative of exploration, reaffirming our collective quest to unearth truths of the universe. Yet, the discovery of the Higgs boson is not an epilogue but rather a prologue, suggesting fertile fields of inquiry awaiting those brave enough to venture further into the cosmic unknown.",long,medium,abstract,3rd,past
physical_sciences,descriptive,technical,Grade12,Inside a Nuclear Reactor,"Inside a nuclear reactor, a realm of controlled chaos unfolds, crafting energy through the dance of atomic particles. At the heart lies the reactor core, laden with fuel rods composed of enriched uranium or plutonium. Subatomic particles, neutrons, flit between these rods, instigating fission processes wherein atomic nuclei split, releasing formidable quantities of energy. This energy, primarily in heat form, transfers to a coolant, often water, coursing through labyrinthine pipes surrounding the core. As this water absorbs heat, it transforms into steam, driving turbines with immense force to generate electricity. Control rods, made from materials like boron, play a crucial role, absorbing excess neutrons to prevent runaway reactions, ensuring equilibrium within the core. Encased by robust containment structures, designed to restrain radiation and withstand pressures, safety remains paramount. Within this technical marvel, precision and science converge, manifesting as a sophisticated symphony of physics, engineering, and innovation, all captured within the confines of a reactor, tirelessly generating the lifeblood of modern civilization: electricity.",mixed,medium,concrete,3rd,present
physical_sciences,process_explanation,reflective,Grade12,Decoding the Colors of Light,"In the future, deciphering the complexity of light could transform our understanding of the universe. To begin, consider light as a spectrum, composed of different wavelengths, each representing distinct colors from deep violet to blazing red. When light traverses a medium like a prism, it refracts—bending and splitting into a fan of colors, revealing its hidden spectrum. The process at play, known as dispersion, is crucial not only for understanding the properties of light but for interpreting the vast tapestry of the cosmos. By studying how light from distant stars and galaxies disperses, scientists gain insights into their composition, temperature, motion, and even age. Imagine, through advanced spectroscopic techniques in the future, the potential to peer further into space—analyzing light not just as a source of illumination but a cosmic storyteller, narrating the grand history of the universe. You might envision enhancing practical applications, from developing superior telecommunication technologies to creating more efficient energy solutions. Reflecting on this, one realizes that the study of light embodies a pursuit that might illuminate countless mysteries, as humankind continues to thread the vastness of space, inspired by light's simple yet profound celestial journey.",long,medium,abstract,2nd,future
