domain,mode,tone,reading_level,title,paragraph,style.sentence_length,style.figurative_language,style.concreteness,style.viewpoint,style.temporal_focus
physical_sciences,persuasive,technical,Undergraduate,Embracing Superconductivity,"Superconductivity heralds a transformative era in electrical engineering and applied sciences. As a phenomenon, it occurs when certain materials exhibit zero electrical resistance at temperatures near absolute zero, enabling electricity to flow freely without energy loss. By reducing resistance, superconductors allow for the creation of potent magnetic fields and highly efficient electrical systems. Imagine the application in magnetic levitation trains, which can glide smoothly, efficiently, and at incredible speeds, facilitated by superconducting magnets. Additionally, in the realm of medical imaging, superconductors power MRI machines, enhancing diagnostic capabilities significantly. The profound impact of superconductivity extends to the development of faster, energy-efficient electronics, enabling more complex computational tasks while reducing power consumption. Despite the hurdles of operating at low temperatures, the pursuit of room-temperature superconductors continues. Consider this: by embracing superconductivity, you can propel innovation across industries, fostering advanced technologies that align with sustainable energy goals, minimizing environmental impact. This is not merely a speculative future; rather, a proactive pathway towards realizing potential outcomes that superconductivity promises, revolutionizing the very foundation of power efficiency and technological progress.",mixed,low,mixed,2nd,present
physical_sciences,narrative,conversational,Graduate,The Carbon Dating Adventure,"Last summer, I embarked on an intriguing adventure—carbon dating ancient artifacts. Equipped with knowledge and curiosity, we delved into radiocarbon laboratories, intent on exploring the age-old secrets of human history. The lab buzzed with anticipation as samples were prepared. Strands of charcoal, once part of ancient fires, were reduced to graphite under precise conditions, ready for measurement. Each sample held stories from eras long forgotten, whispering clues of civilizations past. We meticulously counted radiation emissions, signals of decay within carbon-14, unraveling the timeline of human activity. As results emerged, the sense of discovery was palpable. Holding an artifact and knowing its age connected us to ancestors, enriching the continuum of human heritage. The analytical precision, combined with the emotive journey of discovery, made each moment significant. It was as if time narrated its tale, aligning science with history, as technology revealed the layers of human experience, constructing a bridge to our collective past and humanity's enduring legacy.",short,medium,concrete,1st,past
physical_sciences,expository,plain,Grade8,Basics of Simple Machines,"Simple machines make life easier by allowing us to do work using less force. There are six basic types: the lever, wheel and axle, pulley, inclined plane, wedge, and screw. Each machine helps move, lift, or separate objects more easily. A lever, for example, consists of a rod resting on a pivot point, called a fulcrum. By applying force to one end, a lever can lift heavy loads. Wheels and axles make it easier to move things over distances. Pulleys use ropes and wheels to lift by distributing weight more effectively. Inclined planes or ramps reduce effort needed to raise objects by extending the distance over which force is applied. Wedges cut or split materials apart. Screws convert rotational force to linear force, holding objects together or lifting them. These concepts form the foundation of many tools and machines used daily. Understanding simple machines helps us recognize how various tools work, paving the way for learning more complex concepts in physics and engineering.",short,none,concrete,3rd,present
physical_sciences,descriptive,reflective,Undergraduate,The Beauty of Crystalline Symmetry,"Amidst the crystalline world lies a profound beauty born of symmetry and order, whispered across silent lattices. Each crystal, a marvel of nature, embodies a microcosm of perfection where atomic whispers align into grand symmetrical dances, choreographing patterns that resonate with universal harmony. While studying these shimmering structures, I often find their symmetry evokes a deeper reflection on the patterns woven throughout life, mirroring the natural rhythm and balance omnipresent in existence. Consider a diamond’s face, not merely a facet of geometric intricacy, but a testament to nature’s artistry—each precise angle and edge delicately balancing forces of creation and destruction, unity and distinction. In such configurations, one may perceive an underlying cosmic blueprint, inspiring an appreciation for the elegance embedded within the fabric of the universe. This symmetry, silently orchestrating crystalline formations, serves as a reminder of the seamless integration of order and beauty within the chaos and randomness of the natural world. As I delve deeper, this crystalline symmetry becomes not just a scientific curiosity, but an enduring metaphor for the interconnections that shape our reality, inviting us to marvel at both the seen and unseen architectures of life.",long,high,abstract,1st,present
physical_sciences,process_explanation,plain,Grade12,Creating a Simple Circuit,"Creating a simple electrical circuit can be both educational and fun. Begin with gathering essential components: a power source, such as a battery, a few wires, a switch, and a small bulb or LED. First, connect one end of a wire to the positive terminal of the battery. Attach the other end to one terminal of the switch. Then, use a second wire to connect the switch’s remaining terminal to the bulb's positive side. Finally, a third wire links the bulb to the battery's negative terminal, completing the circuit. Now, when the switch is turned on, electricity flows through the wires, illuminating the bulb. This basic setup demonstrates the principle that electric current follows a path, or circuit, from a power source, through components, and back to the source. It's a foundational concept illustrating how electrical systems operate in everything from household gadgets to complex electronic devices. This hands-on experience not only illustrates electrical principles but also encourages exploration, creativity, and a deeper understanding of the technology surrounding us.",mixed,low,concrete,2nd,present
physical_sciences,persuasive,conversational,Undergraduate,The Importance of Learning Astronomy,"Astronomy, the study of celestial objects and phenomena, offers insights that extend beyond scientific exploration; it kindles wonder, curiosity, and an appreciation of our place in the universe. If you're pondering its importance, consider how astronomy enriches our comprehension of fundamental concepts like time, distance, and our own existence. By observing stars, galaxies, and cosmic events, we connect our planet to the vast tapestry of the cosmos. This cosmic perspective fosters a sense of unity and collective identity, transcending individual experiences. Moreover, advances in astronomical research drive technological innovation. From GPS navigation to climate modeling, astronomical tools have redefined various fields, underscoring their practical relevance. Studying celestial phenomena cultivates analytical and critical thinking, skills essential in numerous disciplines. Additionally, space exploration invites us to ask profound questions about life, its origins, and its sustainability. Astronomy encourages a culture of inquiry, inspiring imagination and creativity—a powerful catalyst for growth. By engaging with astronomy, we participate in a human tradition of wonder and discovery, extending across cultures and generations, guiding us towards a future of boundless possibilities.",mixed,medium,mixed,3rd,present
physical_sciences,narrative,plain,Graduate,The Underground Neutrino Experiment,"In the dim silence of an underground laboratory, the neutrino experiment unfolded like a script juxtaposing simplicity with complexity. We worked within a cavernous chamber etched deep into the earth, far removed from cosmic noise. Here, our pursuit was to detect neutrinos—elusive particles that seldom interact with matter, whispering across the universe undetected by human senses. Holding witness to these ephemeral particles required a concoction of advanced detectors and palpable patience. My role involved calibrating sensitive photodetectors, each programmed to catch mere flashes signifying a neutrino collision. As days stretched into weeks, and weeks into months, the vast tank of pure water around us stood sentinel, awaiting momentary glimmers of evidence. Data was parsed with precision, revealing patterns that illuminated our understanding of these fundamental particles. Moment by moment, test after test, the significance of the task grew, as did the challenges faced, but so too did our resolve. Through setbacks and breakthroughs, the experiment became more than data—every detection a delicate dance of cosmic invisibility becoming visibility, crystallizing the abstract into the tangible exploration of a universe whose secrets beckon from particles unseen.",mixed,medium,mixed,1st,past
physical_sciences,expository,technical,Graduate,The Mechanics of Particle Accelerators,"Particle accelerators are instrumental facilities in experimental physics, responsible for probing the fundamental constituents of matter. By accelerating charged particles, such as protons and electrons, they achieve velocities approaching the speed of light, allowing collision at energies sufficient to break subatomic bonds and reveal the interactions governed by fundamental forces. The workings of a particle accelerator begin with a source of charged particles, which are initially accelerated by an electric field. As they travel, these particles are guided and further accelerated by precisely aligned magnetic fields created by dipole and quadrupole magnets. Furthermore, in synchrotrons— a type of circular accelerator—particles follow a defined circular path, gaining energy with each lap through a series of radio-frequency cavities enhancing their velocity incrementally. Upon reaching desired energies, these particles collide, producing secondary particles tracked by complex detector arrays. Data captured from these collisions allows physicists to test theoretical predictions, explore particle masses, and investigate phenomena like antimatter or the potential existence of additional dimensions. Indeed, these accelerators represent sophisticated amalgamations of physics, engineering, and computational technology, facilitating profound insights into the building blocks of the universe.",long,none,mixed,3rd,present
physical_sciences,descriptive,conversational,Grade12,Understanding Refraction,"Have you ever noticed a straw appearing bent in a glass of water? That's refraction at work. When light travels from one medium to another, like air into water, it bends. This bending is due to light changing speed as it enters a new medium. It's a fascinating phenomenon that helps explain many everyday sights. Consider why the road looks wet on a hot day. It's the air's refraction fooling your eyes! Lenses, like those in glasses or cameras, also rely on refraction to focus light, making things clearer or capturing images. The way light bends reveals secrets of our world, from creating rainbows to explaining optical illusions. Next time you look at something shiny or through a window, remember, it’s refraction revealing a world full of surprises, showing how light can play tricks and teach us at the same time.",short,low,concrete,2nd,present
physical_sciences,process_explanation,technical,Graduate,The Future of Semiconductor Manufacturing,"Semiconductor manufacturing, a cornerstone of modern electronics, is poised to undergo transformative advancements, promising increased efficiency and miniaturization. In the near future, you'll witness processes beginning with silicon wafers, the foundational substrates on which intricate circuits are etched using photolithography—a technique where ultraviolet light patterns circuits onto the wafer's photosensitive surface. Successive layers are deposited and etched, constructing billions of transistors, each a microscopic switch in the device. Advancements aim to introduce extreme ultraviolet lithography (EUV), further shrinking component size while increasing processing power and energy efficiency. Complementary processes, such as chemical vapor deposition and plasma etching, which you might encounter, offer high precision in crafting the nanoscale architecture of semiconductor devices. Moreover, the promising advent of materials like graphene could revolutionize these devices' conductivity and flexibility. As you engage with evolving methodologies, expect semiconductor fabrication to help drive innovations in artificial intelligence, quantum computing, and advanced communications, ensuring the relentless pace of technological evolution marches forward unimpeded, heralding untapped complexity and novel functionality in future generations of electronic devices.",long,none,concrete,2nd,future
physical_sciences,persuasive,reflective,Grade12,Why Embrace Renewable Energy,"As I reflect on the mounting environmental challenges, the argument for embracing renewable energy becomes ever more compelling. The sun's rays, faithfully bathing Earth in copious energy, offer a sustainable solution that, once captured, provides limitless potential. Solar panels, seated atop roofs or sprawling across deserts, convert sunlight into electricity without emitting pollutants—a stark contrast to fossil fuels, which cloak the sky with emissions. Wind farms, scattering their graceful turbines across landscapes, harvest natural breezes, spinning them into clean power. Each gust captured echoes the commitment to preserve the planet's delicate ecosystems. Ocean waves and geothermal sites hold further promise, brimming with untapped energy eager to be converted and utilized. In turning towards renewables, we choose to lighten the environmental load, addressing climate change head-on and steering humanity towards a cleaner future. As our consumption habits evolve, leaning into sustainable energy becomes a moral imperative, echoed by the solemn whispers of melting ice caps and rising seas. The shift isn't merely an environmental undertaking but a legacy of innovation, responsibility, and intergenerational stewardship. As we embrace these technologies, each watt generated symbolizes a step towards a sustainable coexistence with this planet we so earnestly call home.",long,medium,mixed,1st,present
physical_sciences,narrative,technical,Undergraduate,The Quantum Computing Lab,"Within the confines of a quantum computing lab, a university team embarked on designing a new quantum processor prototype. The environment buzzed with precision and focus, governed by the meticulous requirements inherent in quantum experimentation. Every device from dilution refrigerators preserving near-absolute zero environments to the sophisticated lasers fine-tuning qubit states echoed the intersection of advanced physics and cutting-edge engineering. Each qubit, a whisper of quantum information, promised exponential computational capabilities, held its place within the matrix of this nascent processor. The researchers manipulated these qubits with electromagnetic pulses as programmers might write lines of code, choreographing an intricate ballet amidst amplitudes of quantum superposition and entanglement. Yet, challenges of decoherence and error rates loomed large, demanding innovative solutions and unyielding perseverance. As the prototype progressed, every successful entanglement mirrored steps toward realizing the potential of quantum computation, poised to redefine problem-solving paradigms across domains like cryptography, materials science, and even climate modeling. The lab, a nucleus of technological research, symbolized the threshold of a frontier where theoretical constructs become viable tools, heralding a revolution in computational thinking.",long,low,abstract,3rd,present
physical_sciences,expository,plain,Undergraduate,How Electricity is Delivered to Homes,"Electricity travels a long journey to light up your home. It starts at a power plant, where it's generated through many means, like coal, natural gas, nuclear power, or renewables like wind and solar. Once generated, electricity moves to a transformer that steps up the voltage, reducing losses over long distances. Traveling on high-voltage transmission lines, electricity reaches substations where the voltage steps down. There, local distribution lines take charge, delivering electricity to neighborhoods. As it nears homes, another transformer reduces the voltage again, making it safe for household use. Finally, electricity enters your home through a meter, measuring consumption. Throughout this path, engineers ensure it’s reliable and efficient, providing the energy powering everyday life. Understanding how electricity reaches you highlights the complexity and coordination necessary to keep the lights on and devices running, moving from large-scale production to personal use seamlessly.",short,low,concrete,2nd,present
physical_sciences,descriptive,formal,Graduate,The Radiance of Magnetar Flares,"The universe hosts a pantheon of stellar phenomena, none quite as enigmatic or spectacular as magnetar flares. These astronomical events stem from magnetars—neutron stars endowed with magnetic fields magnitudes greater than typical pulsars. When the tectonic scales of a magnetar's crust shift, immense energy is released as flares, sometimes outshining entire galaxies, albeit briefly. From the vantage of Earthly observatories, these flares manifest as radiant gamma-ray bursts, cascading through the cosmos. The subsequent energy release, characterized by high-energy electromagnetic emissions, invokes comparative analyses with solar flares, albeit exponentially more forceful. Researchers, examining historical data from orbiting telescopes, have discerned the underlying mechanics governing these eruptions, offering insights into both electromagnetic field dynamics and stellar evolution. The ferocious beauty of magnetar flares, therefore, stands not just as cosmic lightshows but as windows peering into extreme physics, enhancing our grasp on matter and forces at their most primeval. Reflecting on these events illuminates the interplay between chaos and order, encapsulating a celestial dance compelling by its sheer intensity and its whisper of divine symmetry, emblematic of the universe's vast and multifaceted narrative.",long,medium,mixed,3rd,past
physical_sciences,process_explanation,plain,Grade8,How Clouds Form,"Let me explain how clouds form. It all starts with the sun heating the Earth's surface. This causes water to evaporate and turn into vapor. This vapor rises into the air. As it climbs higher, the air becomes cooler. When the air cools, the water vapor changes back into tiny liquid droplets. These droplets cluster together to form clouds. Sometimes, if the air is very cold, the droplets become ice crystals. These clouds float in the sky, sometimes blocking the sun, other times bringing rain or snow. Watching them can help predict weather changes. This process is a cycle, continuing as long as there is water and sun. Understanding clouds helps us appreciate and anticipate weather patterns.",short,low,concrete,1st,present
physical_sciences,persuasive,playful,Grade12,The Appeal of Cosmic Exploration,"Dive into the exciting world of cosmic exploration! Picture this: galaxies as bustling cities in a universe-sized metropolis, each with unique stories to share. Why stick to your neighborhood when there's a universe out there? Exploring the cosmos isn’t just about examining rocks on faraway planets. It's the ultimate scavenger hunt, where you unravel puzzles scattered across light-years. By venturing space-bound, we tap into mysteries waiting like treasure chests—riches of knowledge about life, the universe, and everything else. Imagine holding stardust, a relic from cosmic ancestors, telling tales older than the Earth itself. It’s time for you to suit up in imagination's spacesuit and float in zero gravity, pondering the wonders woven into the fabric of space. What's beyond the next galaxy? The answers are whispers in the starry sea. Explorers dare to dream, to reach beyond horizons of our blue marble, to stretch arms into the void. So why sit idle? Embrace the cosmic canvas; paint your place among the stars, and let's write the universe's next chapter together. Your voyage starts now! The cosmos awaits your curiosity and courage.",mixed,high,mixed,2nd,present
